reviewId,userName,userImage,content,score,thumbsUpCount,reviewCreatedVersion,at,replyContent,repliedAt,appVersion
d8593905-e027-4f27-9c37-0987c612a32c,A Google user,https://play-lh.googleusercontent.com/EGemoI2NTXmTsBVtJqk8jxF9rh8ApRWfsIMQSt2uE4OcpQqbFu7f7NbTK05lx80nuSijCz7sc3a277R67g,"Not intuitive to determine your cash balance or your earnings, especially on an as annual basis. I only use because I am a bank of America customer which I am also beginning to qed question.",1,0,9.0.154,2019-10-05 13:26:02,,,9.0.154
47c424db-7ec8-4584-b398-299d1071bb8e,A Google user,https://play-lh.googleusercontent.com/EGemoI2NTXmTsBVtJqk8jxF9rh8ApRWfsIMQSt2uE4OcpQqbFu7f7NbTK05lx80nuSijCz7sc3a277R67g,Less useful info on main screen than other brokers apps.,3,0,9.0.154,2019-10-04 19:11:44,,,9.0.154
75a063fb-ac9b-42a2-97e0-1c5651a65f61,A Google user,https://play-lh.googleusercontent.com/EGemoI2NTXmTsBVtJqk8jxF9rh8ApRWfsIMQSt2uE4OcpQqbFu7f7NbTK05lx80nuSijCz7sc3a277R67g,Not very user friendly,2,0,9.0.154,2019-10-04 00:05:47,,,9.0.154
876848f5-df66-48cd-a10a-9848dc1f8e22,A Google user,https://play-lh.googleusercontent.com/EGemoI2NTXmTsBVtJqk8jxF9rh8ApRWfsIMQSt2uE4OcpQqbFu7f7NbTK05lx80nuSijCz7sc3a277R67g,Exactly what you need,4,0,9.0.154,2019-10-03 19:19:00,,,9.0.154
e45f2707-f492-4d30-9c57-846443cab6ac,A Google user,https://play-lh.googleusercontent.com/EGemoI2NTXmTsBVtJqk8jxF9rh8ApRWfsIMQSt2uE4OcpQqbFu7f7NbTK05lx80nuSijCz7sc3a277R67g,Some desirable functions don't work on a mobile device. Extremely irritating.,1,0,2.9.76,2019-10-03 18:51:01,,,2.9.76
6e39ba53-0ec7-46f2-a713-0e0ad2766c88,A Google user,https://play-lh.googleusercontent.com/EGemoI2NTXmTsBVtJqk8jxF9rh8ApRWfsIMQSt2uE4OcpQqbFu7f7NbTK05lx80nuSijCz7sc3a277R67g,"Some problems with loading and user interface. With a money management app there can't be any problems. It makes me nervous everytime I can't access the application. Additionally, if I want to buy to sell a security and I don't have access I miss the opportunity, also bad.",2,6,9.0.154,2019-10-03 17:42:48,,,9.0.154
73311171-ee96-4804-a530-7c3c08b1835f,A Google user,https://play-lh.googleusercontent.com/EGemoI2NTXmTsBVtJqk8jxF9rh8ApRWfsIMQSt2uE4OcpQqbFu7f7NbTK05lx80nuSijCz7sc3a277R67g,So far working well!,5,0,9.0.154,2019-10-03 04:47:55,,,9.0.154
02c538d4-e31d-4886-a31a-ad3ca5f0bd4f,A Google user,https://play-lh.googleusercontent.com/EGemoI2NTXmTsBVtJqk8jxF9rh8ApRWfsIMQSt2uE4OcpQqbFu7f7NbTK05lx80nuSijCz7sc3a277R67g,Good stuff,4,0,9.0.154,2019-10-02 14:35:46,,,9.0.154
1cb18494-8358-4179-9afe-0d7c03bd737a,A Google user,https://play-lh.googleusercontent.com/EGemoI2NTXmTsBVtJqk8jxF9rh8ApRWfsIMQSt2uE4OcpQqbFu7f7NbTK05lx80nuSijCz7sc3a277R67g,The app will not load. Had to reinstall.,3,0,9.0.154,2019-10-02 10:03:58,,,9.0.154
5718538b-f4bb-4d42-9e90-1fd3693f4810,A Google user,https://play-lh.googleusercontent.com/EGemoI2NTXmTsBVtJqk8jxF9rh8ApRWfsIMQSt2uE4OcpQqbFu7f7NbTK05lx80nuSijCz7sc3a277R67g,Great Investing App,5,0,9.0.154,2019-10-01 16:38:49,,,9.0.154
b774072c-5e43-4cba-b94a-8f8c71f16907,A Google user,https://play-lh.googleusercontent.com/EGemoI2NTXmTsBVtJqk8jxF9rh8ApRWfsIMQSt2uE4OcpQqbFu7f7NbTK05lx80nuSijCz7sc3a277R67g,"There is no decimal on the keyboard feature when it comes to mutual fund. I can't deposit 15.02, only 15. Why can't the 2 cents being traded?",1,0,9.0.154,2019-09-30 19:43:53,,,9.0.154
27f68357-4199-4253-8fad-cc9611d69244,A Google user,https://play-lh.googleusercontent.com/EGemoI2NTXmTsBVtJqk8jxF9rh8ApRWfsIMQSt2uE4OcpQqbFu7f7NbTK05lx80nuSijCz7sc3a277R67g,"Not as fully featured as the website, but easy to use and gets most of the important stuff done.",5,0,9.0.154,2019-09-28 17:59:10,,,9.0.154
7add4e14-f68e-4485-89a9-69cb646102e1,A Google user,https://play-lh.googleusercontent.com/EGemoI2NTXmTsBVtJqk8jxF9rh8ApRWfsIMQSt2uE4OcpQqbFu7f7NbTK05lx80nuSijCz7sc3a277R67g,"Horrible! Never ever works. Then you call them, they do a ""reset"" and the reset doesn't work and you have to call them a 2nd and 3rd time. Eventually you are forced to login via the website. The website then informs you your account access has been disable and ANOTHER phone call is needed. I will be moving my accounts with in the next week.",1,14,9.0.154,2019-09-27 17:05:50,,,9.0.154
50bf9138-ece3-4174-bb76-23209b012873,A Google user,https://play-lh.googleusercontent.com/EGemoI2NTXmTsBVtJqk8jxF9rh8ApRWfsIMQSt2uE4OcpQqbFu7f7NbTK05lx80nuSijCz7sc3a277R67g,"Outstanding, no issues so far. Just signed up today for the Cash Management Account 😁. It allowed me to deposit $0.01...(did it to make sure the transfer process would go smoothly). Plan on larger deposits/transfers in the future. I'm impressed at this point. Thought a huge opening deposit would be required. It allows you to bank/invest on your time and budget. Thanks Merrill Edge. (Easy to link your Bank of America or external accounts as well). Thumbs up👍!!!!!!!",5,4,9.0.154,2019-09-27 12:53:49,,,9.0.154
36e3af81-fc9f-4229-ac00-05d0d837bd59,A Google user,https://play-lh.googleusercontent.com/EGemoI2NTXmTsBVtJqk8jxF9rh8ApRWfsIMQSt2uE4OcpQqbFu7f7NbTK05lx80nuSijCz7sc3a277R67g,User interface is not great. It feels clunky. Wish it were more like Robinhood so that I could look at the analytics all in one place and have a bigger picture of the movement of the market. Has potential but not as fun to work with.,3,3,9.0.154,2019-09-26 17:04:26,,,9.0.154
c8848f8a-547a-4b78-8542-604f9faa0546,A Google user,https://play-lh.googleusercontent.com/EGemoI2NTXmTsBVtJqk8jxF9rh8ApRWfsIMQSt2uE4OcpQqbFu7f7NbTK05lx80nuSijCz7sc3a277R67g,"Choosing tax lots .... to sell, is a must. Why can't I sell what I want to sell. I had to call in my order, and .... I was probably handled by 3 persons. No bueno. Dumb.",2,0,9.0.154,2019-09-26 00:48:22,,,9.0.154
3e5df4c0-1963-4a73-a4fd-8ac77b736677,A Google user,https://play-lh.googleusercontent.com/EGemoI2NTXmTsBVtJqk8jxF9rh8ApRWfsIMQSt2uE4OcpQqbFu7f7NbTK05lx80nuSijCz7sc3a277R67g,Now forces you to login to see how the DJIA is doing. Uninstalled,1,0,,2019-09-25 16:05:54,,,
b21c4cbb-a3fd-410a-bdec-3bead89023a1,A Google user,https://play-lh.googleusercontent.com/EGemoI2NTXmTsBVtJqk8jxF9rh8ApRWfsIMQSt2uE4OcpQqbFu7f7NbTK05lx80nuSijCz7sc3a277R67g,"Quotes are behind, app runs slow, placing trades is always an issue or delay. Help your costing me money.",2,0,9.0.154,2019-09-25 12:04:02,,,9.0.154
c311f6b4-9d6d-4b24-94b9-d8223f58e7de,A Google user,https://play-lh.googleusercontent.com/EGemoI2NTXmTsBVtJqk8jxF9rh8ApRWfsIMQSt2uE4OcpQqbFu7f7NbTK05lx80nuSijCz7sc3a277R67g,Perfect! Perfect!,5,0,8.5.150,2019-09-25 05:05:00,,,8.5.150
6fe388b9-3591-45e9-80f9-811a1cb5c444,A Google user,https://play-lh.googleusercontent.com/EGemoI2NTXmTsBVtJqk8jxF9rh8ApRWfsIMQSt2uE4OcpQqbFu7f7NbTK05lx80nuSijCz7sc3a277R67g,"Dashboard commingles accounts obscuring daily performance and shuffling holdings. In ""Accounts"" there's no performance preview. Once in the account, layout is bulky and only displays 2 adjacent variables at a time.",2,0,8.5.150,2019-09-24 14:28:05,,,8.5.150
8a124d2e-31a4-4e76-ad9f-7a53f7827501,A Google user,https://play-lh.googleusercontent.com/EGemoI2NTXmTsBVtJqk8jxF9rh8ApRWfsIMQSt2uE4OcpQqbFu7f7NbTK05lx80nuSijCz7sc3a277R67g,"The app keeps having bugs for the ladt few years. Can't roll option positions properly and log in issue persists, not to mention there is no way to roll a spread position all at once. Been calling customer services for the last two years but the same issues persist.",1,1,8.1.99,2019-09-23 20:03:03,,,8.1.99
be3358e7-5e60-4081-8035-671c3f2a3265,A Google user,https://play-lh.googleusercontent.com/EGemoI2NTXmTsBVtJqk8jxF9rh8ApRWfsIMQSt2uE4OcpQqbFu7f7NbTK05lx80nuSijCz7sc3a277R67g,Cant up date,1,0,8.4.197,2019-09-23 00:41:28,,,8.4.197
79910f70-7002-4731-b7f0-4391e25f5577,A Google user,https://play-lh.googleusercontent.com/EGemoI2NTXmTsBVtJqk8jxF9rh8ApRWfsIMQSt2uE4OcpQqbFu7f7NbTK05lx80nuSijCz7sc3a277R67g,Great,5,0,8.5.150,2019-09-22 03:38:55,,,8.5.150
672ddec3-1c17-4e2e-acf4-50139a4aaeeb,A Google user,https://play-lh.googleusercontent.com/EGemoI2NTXmTsBVtJqk8jxF9rh8ApRWfsIMQSt2uE4OcpQqbFu7f7NbTK05lx80nuSijCz7sc3a277R67g,Great,5,0,8.5.145,2019-09-20 00:14:24,,,8.5.145
b4c09af9-318c-4eaf-ad21-4deb31d8f587,A Google user,https://play-lh.googleusercontent.com/EGemoI2NTXmTsBVtJqk8jxF9rh8ApRWfsIMQSt2uE4OcpQqbFu7f7NbTK05lx80nuSijCz7sc3a277R67g,"It is usable but sucks. How do you go back from the trading screens to the holdings? This is ridiculous. Also how do you find the details for the options?? The Greeks are very important. I end up using the Schwab app for information, and the ML app for trading.",2,0,8.5.150,2019-09-19 19:14:27,,,8.5.150
a8152bef-b93a-4b77-adcd-1e635c19fc11,A Google user,https://play-lh.googleusercontent.com/EGemoI2NTXmTsBVtJqk8jxF9rh8ApRWfsIMQSt2uE4OcpQqbFu7f7NbTK05lx80nuSijCz7sc3a277R67g,Easy,5,0,8.5.150,2019-09-18 23:57:57,,,8.5.150
81f6ea8f-c485-422b-a9fc-351e3ff4bfb3,A Google user,https://play-lh.googleusercontent.com/EGemoI2NTXmTsBVtJqk8jxF9rh8ApRWfsIMQSt2uE4OcpQqbFu7f7NbTK05lx80nuSijCz7sc3a277R67g,Love this app,5,0,8.5.150,2019-09-18 13:49:21,,,8.5.150
fed98abf-28d5-4324-8a94-d41b505961ce,A Google user,https://play-lh.googleusercontent.com/EGemoI2NTXmTsBVtJqk8jxF9rh8ApRWfsIMQSt2uE4OcpQqbFu7f7NbTK05lx80nuSijCz7sc3a277R67g,Easy to navigate.,5,0,8.5.150,2019-09-17 18:08:10,,,8.5.150
2e7e43c8-699c-4405-bdc6-4541e6639b88,A Google user,https://play-lh.googleusercontent.com/EGemoI2NTXmTsBVtJqk8jxF9rh8ApRWfsIMQSt2uE4OcpQqbFu7f7NbTK05lx80nuSijCz7sc3a277R67g,Can't login every few days and forces me to use a browser.,3,0,8.5.150,2019-09-17 14:00:20,,,8.5.150
fef52263-9e8d-4495-9ce8-96b9ba6a9e47,A Google user,https://play-lh.googleusercontent.com/EGemoI2NTXmTsBVtJqk8jxF9rh8ApRWfsIMQSt2uE4OcpQqbFu7f7NbTK05lx80nuSijCz7sc3a277R67g,They have continued to improve the user experience over the duration I have had the app.,4,0,8.5.150,2019-09-16 22:06:48,,,8.5.150
ef25b9d9-09e3-4f6a-95e0-86503355c598,A Google user,https://play-lh.googleusercontent.com/EGemoI2NTXmTsBVtJqk8jxF9rh8ApRWfsIMQSt2uE4OcpQqbFu7f7NbTK05lx80nuSijCz7sc3a277R67g,Enough info to small screen for trading and balance check.,4,0,8.5.150,2019-09-13 18:40:05,,,8.5.150
306fb47d-12a3-4e65-aab7-12245d3b6ae2,A Google user,https://play-lh.googleusercontent.com/EGemoI2NTXmTsBVtJqk8jxF9rh8ApRWfsIMQSt2uE4OcpQqbFu7f7NbTK05lx80nuSijCz7sc3a277R67g,Good,5,0,8.5.150,2019-09-13 17:44:34,,,8.5.150
72ac2c38-44cf-413c-8918-306162d29fe0,A Google user,https://play-lh.googleusercontent.com/EGemoI2NTXmTsBVtJqk8jxF9rh8ApRWfsIMQSt2uE4OcpQqbFu7f7NbTK05lx80nuSijCz7sc3a277R67g,easy to use and has all the needed features,5,1,8.5.150,2019-09-13 13:04:07,,,8.5.150
180b6b8e-a68d-414f-a633-f6e9dd86b76c,A Google user,https://play-lh.googleusercontent.com/EGemoI2NTXmTsBVtJqk8jxF9rh8ApRWfsIMQSt2uE4OcpQqbFu7f7NbTK05lx80nuSijCz7sc3a277R67g,Great app,5,0,8.4.197,2019-09-12 23:55:23,,,8.4.197
e5d60caf-8056-420a-a9d6-5f368caa0dc6,A Google user,https://play-lh.googleusercontent.com/EGemoI2NTXmTsBVtJqk8jxF9rh8ApRWfsIMQSt2uE4OcpQqbFu7f7NbTK05lx80nuSijCz7sc3a277R67g,Good,3,0,8.3.47,2019-09-12 16:52:43,,,8.3.47
ad1e0337-7706-49e8-9774-70e4f4a46d23,A Google user,https://play-lh.googleusercontent.com/EGemoI2NTXmTsBVtJqk8jxF9rh8ApRWfsIMQSt2uE4OcpQqbFu7f7NbTK05lx80nuSijCz7sc3a277R67g,Works fine,5,0,8.5.150,2019-09-12 04:56:46,,,8.5.150
9240c97c-323f-4aac-92be-4c9f975a074e,A Google user,https://play-lh.googleusercontent.com/EGemoI2NTXmTsBVtJqk8jxF9rh8ApRWfsIMQSt2uE4OcpQqbFu7f7NbTK05lx80nuSijCz7sc3a277R67g,Basic functions,4,0,8.5.145,2019-09-12 01:45:41,,,8.5.145
a54b8ebd-f8a9-40e7-972f-1cd1d5b8a8f0,A Google user,https://play-lh.googleusercontent.com/EGemoI2NTXmTsBVtJqk8jxF9rh8ApRWfsIMQSt2uE4OcpQqbFu7f7NbTK05lx80nuSijCz7sc3a277R67g,"Extremely buggy. Often requires multiple login attempts with correct credential/fingerprint to actually get in. Logs out too quickly without ability to adjust timeout, which exacerbate the above issue. Sold securities still listed and incorrectly adjusting overall performance. Streaming stock quotes often not working. I can go on and on. The app is also missing features that are readily available throughout their website, such as ability to purchase securities that they deem ""risky"".",1,8,8.5.150,2019-09-10 14:09:48,,,8.5.150
bdc94a84-13c7-4a7a-9d95-d0b2a8744158,A Google user,https://play-lh.googleusercontent.com/EGemoI2NTXmTsBVtJqk8jxF9rh8ApRWfsIMQSt2uE4OcpQqbFu7f7NbTK05lx80nuSijCz7sc3a277R67g,Good app just wish it had an option to make it dark. It would be easier to read,3,0,8.5.150,2019-09-06 18:52:12,,,8.5.150
489647d5-62f5-420c-8ca3-3add4aa18c2e,A Google user,https://play-lh.googleusercontent.com/EGemoI2NTXmTsBVtJqk8jxF9rh8ApRWfsIMQSt2uE4OcpQqbFu7f7NbTK05lx80nuSijCz7sc3a277R67g,Works Great,5,0,8.5.150,2019-09-05 19:39:30,,,8.5.150
e1922e82-7669-40ab-8972-79e6b2d2dd24,A Google user,https://play-lh.googleusercontent.com/EGemoI2NTXmTsBVtJqk8jxF9rh8ApRWfsIMQSt2uE4OcpQqbFu7f7NbTK05lx80nuSijCz7sc3a277R67g,"I have a Pixel 3XL and the app was always slow to login with, sometimes had to try more than once. Now, since upgrading my phone to Android 10, it's gotten worse. My device is no longer recognized. I need to authenticate every time I login. Merrill also thinks I'm trying to login from Quicken and keeps asking me to finish my Quicken setup, which I keep refusing to do. So I'm done with this app for now. I'll wait for the next update and try again... If I'm still with BoA/Merrill that is.",2,3,8.5.150,2019-09-05 18:10:39,,,8.5.150
8cc3bf44-cf68-47f6-ac93-64cd2e805627,A Google user,https://play-lh.googleusercontent.com/EGemoI2NTXmTsBVtJqk8jxF9rh8ApRWfsIMQSt2uE4OcpQqbFu7f7NbTK05lx80nuSijCz7sc3a277R67g,Does exactly what is advertised,4,0,8.5.150,2019-09-05 14:47:10,,,8.5.150
02636ed1-6575-4d2c-a3a4-2ff1ea4a243d,A Google user,https://play-lh.googleusercontent.com/EGemoI2NTXmTsBVtJqk8jxF9rh8ApRWfsIMQSt2uE4OcpQqbFu7f7NbTK05lx80nuSijCz7sc3a277R67g,Great.,5,0,8.5.150,2019-09-04 16:44:49,,,8.5.150
188c317b-cf14-445b-8372-6b2c2c8dd173,A Google user,https://play-lh.googleusercontent.com/EGemoI2NTXmTsBVtJqk8jxF9rh8ApRWfsIMQSt2uE4OcpQqbFu7f7NbTK05lx80nuSijCz7sc3a277R67g,Good mobile trading platform except for the charting is absolutely terrible. There are no options and is really just garbage.,3,0,8.5.150,2019-09-04 16:27:36,,,8.5.150
89ee8802-8e8e-4fdd-9ffe-c89c30fffd09,A Google user,https://play-lh.googleusercontent.com/EGemoI2NTXmTsBVtJqk8jxF9rh8ApRWfsIMQSt2uE4OcpQqbFu7f7NbTK05lx80nuSijCz7sc3a277R67g,A Merrill edge app is very informative excellent,5,0,8.5.150,2019-09-02 02:31:13,,,8.5.150
a97c96b5-6ca1-4cc4-b11e-a9f41d2db5dd,A Google user,https://play-lh.googleusercontent.com/EGemoI2NTXmTsBVtJqk8jxF9rh8ApRWfsIMQSt2uE4OcpQqbFu7f7NbTK05lx80nuSijCz7sc3a277R67g,Great app.,5,0,8.5.150,2019-08-31 13:30:43,,,8.5.150
3003a272-67e0-40bb-a55d-f76961d30191,A Google user,https://play-lh.googleusercontent.com/EGemoI2NTXmTsBVtJqk8jxF9rh8ApRWfsIMQSt2uE4OcpQqbFu7f7NbTK05lx80nuSijCz7sc3a277R67g,Very Easy to Use,5,0,8.5.150,2019-08-31 13:13:41,,,8.5.150
6b54b258-51ee-4993-b34a-0b21f3068b3c,A Google user,https://play-lh.googleusercontent.com/EGemoI2NTXmTsBVtJqk8jxF9rh8ApRWfsIMQSt2uE4OcpQqbFu7f7NbTK05lx80nuSijCz7sc3a277R67g,Every time I try to close a position the screen locks up at the confirm screen. If you trade options then this will cause you to lose money. You have to back out of the screen and keep trying. Some times it never works and I have to call a rep. My Fidelity app works Everytime! I will be moving my money soon.,1,3,8.5.150,2019-08-29 19:56:02,,,8.5.150
2ccf4169-be8e-4015-ba4f-fcbb2d16898f,A Google user,https://play-lh.googleusercontent.com/EGemoI2NTXmTsBVtJqk8jxF9rh8ApRWfsIMQSt2uE4OcpQqbFu7f7NbTK05lx80nuSijCz7sc3a277R67g,Great app. Full Merrill experience. A winner.,5,0,8.5.150,2019-08-29 16:09:57,,,8.5.150
9aa61d1b-c5ce-4d14-ba1d-e0151a61079c,A Google user,https://play-lh.googleusercontent.com/EGemoI2NTXmTsBVtJqk8jxF9rh8ApRWfsIMQSt2uE4OcpQqbFu7f7NbTK05lx80nuSijCz7sc3a277R67g,Easy to navigate. I kinda prefer it over browser for many things.,5,0,8.5.150,2019-08-29 15:38:28,,,8.5.150
89558588-2834-4221-acd8-cd53b1b95fe8,A Google user,https://play-lh.googleusercontent.com/EGemoI2NTXmTsBVtJqk8jxF9rh8ApRWfsIMQSt2uE4OcpQqbFu7f7NbTK05lx80nuSijCz7sc3a277R67g,"Fingerprint logon doesnt work, and the whole experience is a mess. not worth the time and there are much better and well thought out platforms. Update - fingerprint now works. There is so little info on mobile that you really have to use the desk top version to do anything.",1,1,8.5.150,2019-08-29 12:49:42,,,8.5.150
fcfcdc86-65d4-4876-ab9f-7df610d61970,A Google user,https://play-lh.googleusercontent.com/EGemoI2NTXmTsBVtJqk8jxF9rh8ApRWfsIMQSt2uE4OcpQqbFu7f7NbTK05lx80nuSijCz7sc3a277R67g,No real information listed.,1,0,8.5.150,2019-08-28 16:05:42,,,8.5.150
00bf05c8-1769-47e1-a89d-338fa3c18b14,A Google user,https://play-lh.googleusercontent.com/EGemoI2NTXmTsBVtJqk8jxF9rh8ApRWfsIMQSt2uE4OcpQqbFu7f7NbTK05lx80nuSijCz7sc3a277R67g,"Easy to use and has all the information I need. Wish the charting features were better, but don't typically use it heavily within the app anyways.",5,0,8.5.150,2019-08-28 13:30:59,,,8.5.150
876d1997-2da4-4069-9ff9-6384cfb86a88,A Google user,https://play-lh.googleusercontent.com/EGemoI2NTXmTsBVtJqk8jxF9rh8ApRWfsIMQSt2uE4OcpQqbFu7f7NbTK05lx80nuSijCz7sc3a277R67g,Like this app,5,0,8.5.150,2019-08-28 09:48:56,,,8.5.150
f724ff89-fd7f-47f3-8670-5cf9bad8ad36,A Google user,https://play-lh.googleusercontent.com/EGemoI2NTXmTsBVtJqk8jxF9rh8ApRWfsIMQSt2uE4OcpQqbFu7f7NbTK05lx80nuSijCz7sc3a277R67g,"Easy to use, especially if you have a Bank of America account.",5,1,8.5.150,2019-08-27 00:32:49,,,8.5.150
e5d0ba43-cb13-4558-9ba4-7d6d2514645f,A Google user,https://play-lh.googleusercontent.com/EGemoI2NTXmTsBVtJqk8jxF9rh8ApRWfsIMQSt2uE4OcpQqbFu7f7NbTK05lx80nuSijCz7sc3a277R67g,Okay,4,0,8.5.150,2019-08-26 18:24:20,,,8.5.150
f766ad99-8866-4e9a-a916-811ca2b9390c,A Google user,https://play-lh.googleusercontent.com/EGemoI2NTXmTsBVtJqk8jxF9rh8ApRWfsIMQSt2uE4OcpQqbFu7f7NbTK05lx80nuSijCz7sc3a277R67g,The app was easy to use.,5,0,8.5.150,2019-08-26 05:21:50,,,8.5.150
e8b9d785-798d-410b-923f-ba4c1db0c93e,A Google user,https://play-lh.googleusercontent.com/EGemoI2NTXmTsBVtJqk8jxF9rh8ApRWfsIMQSt2uE4OcpQqbFu7f7NbTK05lx80nuSijCz7sc3a277R67g,exceptional,5,0,8.5.150,2019-08-26 01:43:31,,,8.5.150
1ac053ee-d21a-430b-9b88-53f38d1050e3,A Google user,https://play-lh.googleusercontent.com/EGemoI2NTXmTsBVtJqk8jxF9rh8ApRWfsIMQSt2uE4OcpQqbFu7f7NbTK05lx80nuSijCz7sc3a277R67g,"The app is slow, cluncky and down right a pain to use. Entering trades for anything multi legged is a lesson futility, the prices never update and neither do trade results. Going back to td.",2,4,8.5.150,2019-08-23 14:20:53,,,8.5.150
fe012675-a433-4d6c-95ae-d6baaf1540a9,A Google user,https://play-lh.googleusercontent.com/EGemoI2NTXmTsBVtJqk8jxF9rh8ApRWfsIMQSt2uE4OcpQqbFu7f7NbTK05lx80nuSijCz7sc3a277R67g,Awful... pages dont load fully and too crowded on cell phone.,1,1,8.5.150,2019-08-23 13:47:32,,,8.5.150
f2437d9a-277d-4698-a274-8c05f4f47e45,A Google user,https://play-lh.googleusercontent.com/EGemoI2NTXmTsBVtJqk8jxF9rh8ApRWfsIMQSt2uE4OcpQqbFu7f7NbTK05lx80nuSijCz7sc3a277R67g,i love the connection to Bank of America. It has almost all the features the pc version. The only feature that is missing is the option to transfer mpney fron ira to brokerage account.,5,1,8.5.150,2019-08-20 13:40:56,,,8.5.150
46746532-a792-463e-baf3-a35bfdaf3dfb,A Google user,https://play-lh.googleusercontent.com/EGemoI2NTXmTsBVtJqk8jxF9rh8ApRWfsIMQSt2uE4OcpQqbFu7f7NbTK05lx80nuSijCz7sc3a277R67g,It wanted access to information that i felt the app had no business asking for. I deleted the app because it would not allow me to proceed otherwise.,1,0,,2019-08-20 13:37:08,,,
ca16a790-d40b-4f96-9c17-25fe14e54a4b,A Google user,https://play-lh.googleusercontent.com/EGemoI2NTXmTsBVtJqk8jxF9rh8ApRWfsIMQSt2uE4OcpQqbFu7f7NbTK05lx80nuSijCz7sc3a277R67g,Okay but could be better,3,0,8.5.150,2019-08-20 12:11:35,,,8.5.150
fd3581dc-0b12-4d57-b546-87ecd29b78a8,A Google user,https://play-lh.googleusercontent.com/EGemoI2NTXmTsBVtJqk8jxF9rh8ApRWfsIMQSt2uE4OcpQqbFu7f7NbTK05lx80nuSijCz7sc3a277R67g,good,4,0,8.5.150,2019-08-16 17:32:04,,,8.5.150
c470c019-deaa-4d3a-8398-9ad6ed4b25b0,A Google user,https://play-lh.googleusercontent.com/EGemoI2NTXmTsBVtJqk8jxF9rh8ApRWfsIMQSt2uE4OcpQqbFu7f7NbTK05lx80nuSijCz7sc3a277R67g,Nice app. could use some tweaking but overall pretty good,4,0,8.5.150,2019-08-16 04:22:52,,,8.5.150
8166f68c-5857-40f4-8db5-8a30919075dc,A Google user,https://play-lh.googleusercontent.com/EGemoI2NTXmTsBVtJqk8jxF9rh8ApRWfsIMQSt2uE4OcpQqbFu7f7NbTK05lx80nuSijCz7sc3a277R67g,very convenient and fingerprint login makes getting to your info fast and easy.,4,0,8.5.150,2019-08-16 03:33:10,,,8.5.150
dc87eba8-bf18-45f7-9bea-8e8d518221d1,A Google user,https://play-lh.googleusercontent.com/EGemoI2NTXmTsBVtJqk8jxF9rh8ApRWfsIMQSt2uE4OcpQqbFu7f7NbTK05lx80nuSijCz7sc3a277R67g,"Not for a trader, only recommended for long term investing and checking in on their performance. You'll want to to do almost everything on the full website.",3,1,8.5.150,2019-08-16 00:01:53,,,8.5.150
3e70f3b9-93f1-4cbe-a680-d7dd2e982da8,A Google user,https://play-lh.googleusercontent.com/EGemoI2NTXmTsBVtJqk8jxF9rh8ApRWfsIMQSt2uE4OcpQqbFu7f7NbTK05lx80nuSijCz7sc3a277R67g,I like it because its good,5,1,8.5.150,2019-08-15 21:38:42,,,8.5.150
f9eace99-1ad0-458a-8aa8-2e5995d66970,A Google user,https://play-lh.googleusercontent.com/EGemoI2NTXmTsBVtJqk8jxF9rh8ApRWfsIMQSt2uE4OcpQqbFu7f7NbTK05lx80nuSijCz7sc3a277R67g,learning will rate again after I fully go through the app,4,0,8.5.150,2019-08-15 06:59:25,,,8.5.150
1e7069b4-0799-47e4-87b0-2d47c1e7cfdc,A Google user,https://play-lh.googleusercontent.com/EGemoI2NTXmTsBVtJqk8jxF9rh8ApRWfsIMQSt2uE4OcpQqbFu7f7NbTK05lx80nuSijCz7sc3a277R67g,Don't be afraid to ride the bull! Great app!!,5,0,8.5.150,2019-08-14 22:49:41,,,8.5.150
8183315b-d45d-4f54-83ae-fe19d6304967,A Google user,https://play-lh.googleusercontent.com/EGemoI2NTXmTsBVtJqk8jxF9rh8ApRWfsIMQSt2uE4OcpQqbFu7f7NbTK05lx80nuSijCz7sc3a277R67g,no functionality. cant even pull up money market funds. research is non-existent,1,0,8.5.150,2019-08-14 13:46:49,,,8.5.150
b7112b7c-06d6-42bb-9317-b3e4503267cc,A Google user,https://play-lh.googleusercontent.com/EGemoI2NTXmTsBVtJqk8jxF9rh8ApRWfsIMQSt2uE4OcpQqbFu7f7NbTK05lx80nuSijCz7sc3a277R67g,works great,5,0,8.5.149,2019-08-11 15:16:47,,,8.5.149
f008df6c-82d2-4c0d-a099-db1eab1970d2,A Google user,https://play-lh.googleusercontent.com/EGemoI2NTXmTsBVtJqk8jxF9rh8ApRWfsIMQSt2uE4OcpQqbFu7f7NbTK05lx80nuSijCz7sc3a277R67g,"not very user friendly. Quotes on watch list not accurate. Dates for options not in chronological order. When attempting to make a security trade, quote for security will not auto refresh, leaving doubt in person's mind as to whether they are making the right decision.",2,2,8.5.149,2019-08-09 14:14:15,,,8.5.149
596e7025-8144-4504-be9e-7a46723fa457,A Google user,https://play-lh.googleusercontent.com/EGemoI2NTXmTsBVtJqk8jxF9rh8ApRWfsIMQSt2uE4OcpQqbFu7f7NbTK05lx80nuSijCz7sc3a277R67g,So good so far. Nice viewing format simple and easy to use for data research and warnings before making risky investments.,5,2,8.5.149,2019-08-08 18:44:45,,,8.5.149
a6221479-60ae-4249-8a5a-5745395866ac,A Google user,https://play-lh.googleusercontent.com/EGemoI2NTXmTsBVtJqk8jxF9rh8ApRWfsIMQSt2uE4OcpQqbFu7f7NbTK05lx80nuSijCz7sc3a277R67g,"This vintage app design is old, clunky, slow and unintuitive. Please update the app with a more streamlined design that let's you easily find what is needed. The charts are poorly visualized and don't provide a sliding historic view. Trade history, holdings, summary and stock/news information for a managed stock should be one one page and not require to click through multiple times. Dashboard should have all stocks and holdings up front. Use Robinhood as a bench.",2,8,8.5.149,2019-08-08 16:13:20,,,8.5.149
5c043228-25a3-417e-ab2e-88faedc29482,A Google user,https://play-lh.googleusercontent.com/EGemoI2NTXmTsBVtJqk8jxF9rh8ApRWfsIMQSt2uE4OcpQqbFu7f7NbTK05lx80nuSijCz7sc3a277R67g,"Not at all user friendly, not clear and concise.",1,0,,2019-08-07 23:24:02,,,
07dc763b-26fe-4beb-8001-2b067a226404,A Google user,https://play-lh.googleusercontent.com/EGemoI2NTXmTsBVtJqk8jxF9rh8ApRWfsIMQSt2uE4OcpQqbFu7f7NbTK05lx80nuSijCz7sc3a277R67g,outstanding!,5,0,8.5.149,2019-08-07 17:14:04,,,8.5.149
21dc91f8-3889-4d54-810f-94fa4987ba47,A Google user,https://play-lh.googleusercontent.com/EGemoI2NTXmTsBVtJqk8jxF9rh8ApRWfsIMQSt2uE4OcpQqbFu7f7NbTK05lx80nuSijCz7sc3a277R67g,User friendly and easy to use. faster than logging in on a browser all the time.,5,1,8.5.149,2019-08-06 14:46:46,,,8.5.149
1e13e463-7dba-48b7-be99-373740f50463,A Google user,https://play-lh.googleusercontent.com/EGemoI2NTXmTsBVtJqk8jxF9rh8ApRWfsIMQSt2uE4OcpQqbFu7f7NbTK05lx80nuSijCz7sc3a277R67g,Great app very easy to use,5,0,,2019-08-06 13:40:17,,,
a5a84eb0-a776-46cf-a668-7beaca083352,A Google user,https://play-lh.googleusercontent.com/EGemoI2NTXmTsBVtJqk8jxF9rh8ApRWfsIMQSt2uE4OcpQqbFu7f7NbTK05lx80nuSijCz7sc3a277R67g,unable to do transactions without going directly into website. doesnt recognize codes and customer service is worthless in explaining thoroughly. Going to Prudential and Fidelity!!,1,1,8.5.149,2019-08-06 08:13:15,,,8.5.149
fa63a30d-b1c9-4f76-a3f2-6d6499d8fe55,A Google user,https://play-lh.googleusercontent.com/EGemoI2NTXmTsBVtJqk8jxF9rh8ApRWfsIMQSt2uE4OcpQqbFu7f7NbTK05lx80nuSijCz7sc3a277R67g,so far I like the ease of use with this app,5,0,8.5.149,2019-08-02 03:55:52,,,8.5.149
