reviewId,userName,userImage,content,score,thumbsUpCount,reviewCreatedVersion,at,replyContent,repliedAt,appVersion
ed806e96-5b64-439f-bf1f-4183097df902,Colin Ramsay (Airborne),https://play-lh.googleusercontent.com/a-/ALV-UjUmz9pHjqhlRgbz3DPB77l7LYfkbE5sKF5qKZENt7TH2MlN1ofL,"The app is ok to view your account, but if you want to deposit a check it crashes all the time very frustrating",1,0,22.02.48,2022-02-15 19:22:44,,,22.02.48
a66937ab-9961-4f45-8ed8-3417e8820e1e,Jon,https://play-lh.googleusercontent.com/a-/ALV-UjXzRy1MV7cWRsV1MBxpvAglhgJu4P1qdvjZBw5lcN2dEIzxSM4T,Needs a better watch list like TD Am or eTrade.,3,0,22.02.48,2022-02-15 03:42:17,,,22.02.48
6ae744bd-3d0e-42a2-943d-e38135e26412,Ashish Jagtap,https://play-lh.googleusercontent.com/a-/ALV-UjWUf4yCK-t0f2tjbNGX2cVK4lrOTgk4gnVB757mYPEDvODJGQQs6g,Information is very useful but the app user interface is very clunky,3,1,22.02.48,2022-02-14 13:37:28,,,22.02.48
2fd3356c-cc30-4d15-848b-628a11f658a2,Justin Nguyen-Le,https://play-lh.googleusercontent.com/a/ACg8ocJEvnTQRaq0BsLhiq3v7ptlGfbacTEifDnj4r7m_E8n2YzyuQ=mo,"Great integration with BoA. However, Merrill Edge lacks many features that other brokers provide. I hope that in the future, fractional share purchases are available. The other features that involve ease of use and information for options trading, such as the greeks, would be great to have. Scheduling money transfers is awful. If Merrill Edge ever provides fractional shares purchases, then I would definitely rate 5 stars.",2,28,22.02.48,2022-02-13 19:32:15,,,22.02.48
f344abbc-0dcc-4fd4-8d57-2c05ed68bfd9,Nate G.,https://play-lh.googleusercontent.com/a-/ALV-UjUBXlfAwZnzxU5SvkSG8fAzBt2JImpWw1c5p6QkP-zJuxVIMi2u9w,Great,5,0,22.02.48,2022-02-13 06:15:26,,,22.02.48
bc243bd4-8baa-497f-832f-efd1081002f3,Holland Judkins,https://play-lh.googleusercontent.com/a-/ALV-UjX-M1wVi0ObIjOxwtQYn05x60I27HPxESHqCizmYN9t5qYdk-HU,Hard to navigate. It's not easy to pull up info you want. No pre or after market quotes,3,1,22.02.48,2022-02-10 19:49:55,,,22.02.48
d42ac443-0665-44e9-9e0d-a4d47adfb84c,Tezoc Mixtec,https://play-lh.googleusercontent.com/a/ACg8ocKW_bVRSZrMyzzmIP6oGc__yOxQTWAC81634DuWUgXfkw7ikQ=mo,Easy to use and execute trades.,5,0,21.11.255,2022-02-10 18:48:21,,,21.11.255
57c6a1bd-2a50-4711-a00a-41c240361278,Alvaro Abaunza,https://play-lh.googleusercontent.com/a-/ALV-UjVsoHNbbCdyQjg0Azw-s684F0uh0PHI25gxccPw_KElTzqPNJQ,"Its not hard to read once you figure out what you want to do. I hope it becomes as smooth as robinhood app, and in addition a dark theme option.",3,4,22.02.48,2022-02-10 18:40:10,,,22.02.48
f10883d1-0686-475e-a0ac-8381a9c31f1d,Sohail Sangary Tooloian,https://play-lh.googleusercontent.com/a/ACg8ocIVA2aYVXoPka5eUt9_zScRb11zlbs_xR8jkVj93UKQZRmheg=mo,I think it's a great bank. Very accurate and sincere .,5,0,22.02.48,2022-02-10 16:31:22,,,22.02.48
80fc0a4f-389f-4208-8b3b-396e51219b6d,Jim George,https://play-lh.googleusercontent.com/a-/ALV-UjVNOVbAK6JtlqEebkG7yfQX-PIlGEXttTcZEn-tAjyfugmoZ1E,"Easy to use, well designed, would like more to it.",4,0,22.02.48,2022-02-10 15:17:05,,,22.02.48
5f9ae68e-5712-4ec5-8087-e6b31cf49a34,Alias Da'Don,https://play-lh.googleusercontent.com/a/ACg8ocL7hotjF0ePLEukkhWXkrjBGuiGIlKOLYWBEQjn4pXKMRKFvg=mo,Information provided here is helpful and more accurate than most other sites I've tried,5,0,,2022-02-09 17:18:25,,,
5ad64216-f2e7-4ed0-9471-b9b1b3e3dd38,stephen erenstein,https://play-lh.googleusercontent.com/a/ACg8ocLTTFgpyqfg7ykppYT61bmgiHzeUMKjNCno4P4q8CEO6CFLOQ=mo,Necessary,5,0,21.11.255,2022-02-08 23:08:31,,,21.11.255
172db7d1-0c12-48f6-8f74-b0f0d3d72375,Jim Smith,https://play-lh.googleusercontent.com/a/ACg8ocJCFArdV7oJPtsP85k5A5tuymmrkx10Ruu9hmtOZP0at0zpDA=mo,Easy too use with all the information I need on it.,5,0,22.02.48,2022-02-08 15:02:00,,,22.02.48
ff9adbde-07b2-4dcc-8d95-67723a1c1402,Ram Gandhi,https://play-lh.googleusercontent.com/a/ACg8ocKZK5wpTP2a_qp5pyj3Jy7aExwv2NCyMnUR9EgpjGsQFeCz8Q=mo,"App is not user friendly, still feels very sluggish. Other competitor apps have more features, intutive to use and better visualization graphics.",2,0,21.11.255,2022-02-07 21:32:55,,,21.11.255
0803237d-4161-410b-b3ab-41641f2481f2,Chip Johnson,https://play-lh.googleusercontent.com/a/ACg8ocLZU4ER_YTJm4qQnolHFpugDO0lD0SVQYccC_PW9xn6s3YXZw=mo,Merrill has the best platform and excellent customer service.,5,0,21.11.255,2022-02-04 22:35:10,,,21.11.255
799c651a-aead-4dde-92a1-5c95a30ae9e1,Gene Kengovskiy,https://play-lh.googleusercontent.com/a-/ALV-UjX0A2Mmnvjpf_5OmLTgkFHO1VJsVQ7GAU69O4NK3H4oua_TpO8,The fingerprint login needs to be set up again each time you log out of the application. Why is this?,2,0,21.11.255,2022-02-04 19:18:06,,,21.11.255
b62fcd67-e1b2-4a73-8f2d-6725865ef5ce,7 Mile Productions,https://play-lh.googleusercontent.com/a-/ALV-UjVmLikqh9_MTaJuoh5EHA_STIqJgMkPSpnzuQ-djLysPfbNGtM,Can't live without it!,5,0,21.11.255,2022-02-04 14:13:53,,,21.11.255
021b7762-78c6-4716-9051-ec1ea98902a7,Daniel Cheng (Peng),https://play-lh.googleusercontent.com/a-/ALV-UjVnLcwagxxZhFAg2ni_0h4YmE_0N9Kp957XqA2lwSW5si35AX0,Good.,5,0,21.11.255,2022-02-04 00:28:47,,,21.11.255
c50f69b5-a0dd-438f-93b8-c8733dc69f1d,Nick Richards,https://play-lh.googleusercontent.com/a-/ALV-UjVK6mfOd7LejWqejqAdaZrsUxG4R_kQDMgMXrgvSXiC4oJpuhTpMQ,Does a lot. Very happy to have it. Use it to watch my savings and to deposit checks.,4,0,21.11.255,2022-02-03 19:06:22,,,21.11.255
fbe6643d-5cb4-40ef-a359-fbfc58b9daec,Steve Gallimore,https://play-lh.googleusercontent.com/a-/ALV-UjUfHLyhP2J0KN5Ftb8GTG4glCaEBeM1c7BYi5Tki6Ytu4frfoOfEw,"Please do yourself a huge favor and avoid these people at all costs. They kept my account access off for 3 weeks because they didnt like it that someone made a deposit to my account using a personal check then closed the account and never asked me about it, and continually informed me ( lied ) that the access would be back on in 2 hours , tomorrow , Monday if it was Friday. 3 weeks. These people are the worst of the worst you can ever imagine to deal with in a moden setting. Please avoid",1,0,21.11.255,2022-02-03 01:28:07,,,21.11.255
8a6f2209-8321-4490-8e33-726b78c36781,NoOnes Business,https://play-lh.googleusercontent.com/a-/ALV-UjX6gknNKg5Jv__q53LcDm4rAS3I2_qpkPPFbjUSKpwHZsjcEa9x,Not near as easy to use as the regular Merrill Lynch investment app,2,0,21.11.255,2022-02-02 16:07:43,,,21.11.255
d6b4b1f3-3881-4333-b3c5-ec66862e9a26,Baek kyun Im,https://play-lh.googleusercontent.com/a/ACg8ocJIIwFvYMNucrCU2eCAUygNpmH8yMSS1ptTKICtPlk14VtVSA=mo,Good,4,0,21.11.255,2022-02-02 15:51:46,,,21.11.255
7e1ac14e-6d83-448a-bba3-38657d486270,harold wallace,https://play-lh.googleusercontent.com/a/ACg8ocL5cmcvpTM8bSdv50Gmdg03LVuBqOvxBp1nbqURhkUJ_LhvQA=mo,I am always using the icon I enjoyed the the message the most part about it is the education and the information and the future of my life living,5,0,21.08.192,2022-02-02 12:46:54,,,21.08.192
f7d4ddc5-c668-4190-a83a-240852b657e9,Abdul Mallah,https://play-lh.googleusercontent.com/a-/ALV-UjXZPmzrwOhrXTS1XyJCuU_aHby56b1ttMCoxgj-TAXs6TlO9Dsw,"For months I have been deciding between this and Robinhood. I went with this because I already have a Bank of America account. Signup was really easy. And they have 24/7 help. Research tools are great within the app .The app is very easy to use you can fund your account buy and sell stock all with the convenience of your phone. The only thing make this better would be Call of Duty sound effects when buying ,selling,etc.. seriously think about it.",5,1,21.11.255,2022-02-02 11:29:49,,,21.11.255
6aff3dc8-4226-4b26-a95c-40f0b89db934,Van Webb Jr,https://play-lh.googleusercontent.com/a-/ALV-UjVq6cHciavN1PY0KjhvVxGib2twHTQta8EWtqIcJDWXaewNEXFtEw,Easy to use and to make fast buys and trades,4,0,21.11.255,2022-01-28 17:43:33,,,21.11.255
29b95f82-09df-4cb5-9d4d-2957bb862b4a,Tony Metcalfe,https://play-lh.googleusercontent.com/a/ACg8ocIVSOj3QGORVf7lP53wLdB46Mwucu6Te0xrT_1wespPRsYR_A=mo,"Great app, easy to use and trade equities",5,0,21.11.255,2022-01-28 17:33:51,,,21.11.255
fe9d5cd6-1838-4a59-8ea2-b9c5d2e5ccbd,Tyler,https://play-lh.googleusercontent.com/a/ACg8ocIswv-mligU9hV0PtQtmwAY_wyDaRV1s2OCsW2DtGnjowYnFg=mo,"Great, especially if you bank with BofA",5,0,21.11.255,2022-01-26 21:01:18,,,21.11.255
6d5706f9-37a0-4f3a-a838-82a6b3e63483,Joshua Rhoades,https://play-lh.googleusercontent.com/a-/ALV-UjWDTjHX82TVTmiaoAC9oW4ivqKfH_8dGyBz5Ee2NqRguc5IP8xn,"Good App , stressful market! 🙏",4,0,,2022-01-24 22:23:01,,,
5e6e3f56-6080-4360-9a07-9391b6625fc5,Alejandro Corral,https://play-lh.googleusercontent.com/a-/ALV-UjUwaFjJWnhWz3FlO3FvIZE9_bTB2QGt4-rJMOc34lDwWszr3Rb-,Excelente app.,5,0,21.11.255,2022-01-24 18:09:39,,,21.11.255
59a23981-4a76-43a8-a9ea-0d70133ada80,Joonho lee,https://play-lh.googleusercontent.com/a-/ALV-UjXmOU_U4ZeLbP7njimT6G3vDw6EcDB5XRk6WRTILik4gjPX_GM,Awesome!,5,0,21.11.255,2022-01-24 17:48:39,,,21.11.255
1ae172f0-ada5-43b3-a648-516d43b8e07e,Alex Reyna,https://play-lh.googleusercontent.com/a/ACg8ocKQj2aH18F_ROJA-qHQtuaJ0v5bAVpdyMrpf7KYQScLnf41Bg=mo,Amazing,5,0,21.11.255,2022-01-24 16:24:25,,,21.11.255
fbc6b388-fa7e-4779-89da-0eb635cd24b1,Toni Bertolo,https://play-lh.googleusercontent.com/a/ACg8ocJsAZLIkpnWojS4TvQP_elk9eJiqR7RXy1HfPAal3-uUe2p-is=mo,I find the app difficult to navigate. I don't understand a lot of the information and wish it was easier to decifer.,3,1,21.11.255,2022-01-24 13:46:37,,,21.11.255
25b1d958-703f-4aaa-a540-1a25dff82b2c,don tran,https://play-lh.googleusercontent.com/a/ACg8ocIQWyjA_1KQIXuzdtHlb_lY_fSKiJTu_9m7b-GV9DYtq7nO-A=mo,"good app, but sometime be stop working.",4,0,21.11.255,2022-01-23 20:51:51,,,21.11.255
dc390425-ec67-4723-991d-b2a27e410927,Mustafa Dada,https://play-lh.googleusercontent.com/a/ACg8ocJGLZnnbJlMpOIHnXkhfFm2h9RePInddGntoGT8i4BhMQoWVQ=mo,Useless when you compare it to others like Schwab. Account lockouts are frequent and impossible to undo. Not a good thing with trading apps,1,0,21.11.255,2022-01-23 15:28:17,,,21.11.255
d12e6cb8-a922-44e8-997b-2fe6894105a6,Kit Ying C Choi Ng,https://play-lh.googleusercontent.com/a/ACg8ocLBUyXap7dGb7nUkXN-VqNHUAfv8e2OU1Y0Yjd4RN4TcgRj4Q=mo,Fast and easy to operate,5,0,,2022-01-23 14:56:23,,,
8bc77704-7cf2-4db8-8367-7b9386a52f1b,James Abram,https://play-lh.googleusercontent.com/a/ACg8ocIxuYQpyEHf3pgh2w5Khb9edyiNAdpeIVJPtOuCxbdugNsmQQ=mo,Pretty good,4,0,21.08.192,2022-01-23 10:57:50,,,21.08.192
8f98940f-4cef-40a2-9deb-16b9e30bf770,Mitchell Desmond,https://play-lh.googleusercontent.com/a-/ALV-UjXYQHGB_uTQOtcAAY5nbVvWiynfLnpg76kW-P7h4XIew-E5K0URRg,Asks me to verify my address every time I open the app. Very poorly designed,1,2,21.11.255,2022-01-23 05:02:43,,,21.11.255
e519a05f-acab-4e8a-a68a-64687ff874a3,Asif Saeed,https://play-lh.googleusercontent.com/a/ACg8ocJrAvgVk-PJZZ7B83VNB7U9fKZ8rHub4K7uUiueLE7G-FrzJg=mo,An okay app to trade securities.,3,0,21.11.255,2022-01-23 00:29:17,,,21.11.255
97c98541-ce17-42cb-8f85-5b6b340be00b,Charles Lee,https://play-lh.googleusercontent.com/a/ACg8ocLfXU9gIw3Nh0xlecQDn83zrbpn8lsPICuZFQq77U2EBDMQmw=mo,Too many updates that eat MB's like candy.,2,0,21.08.192,2022-01-22 22:04:29,,,21.08.192
d13d19b9-4092-44b5-b85b-2ab7074ae2fd,Michael,https://play-lh.googleusercontent.com/a/ACg8ocIt0kFmHA3tbkfLL51ziWOsAhDWKUyOb8ya_MlJnozKHMIJuA=mo,"This app needs a lot of work. I've used several trading apps in the past, and none of them are perfect. I haven't been able to find anything I like about the Merrill Edge app. Everything takes way too many taps/screens. The layout is not phone-friendly. The in-app notifications are annoying.",2,2,,2022-01-21 15:00:02,,,
f9598656-2add-4be3-8110-8ac709cc00c4,Herman Halici,https://play-lh.googleusercontent.com/a-/ALV-UjUmteAY0gTWH2FAZpjHMKN1jN8TRRcYyM5oVkl6kNKKpFHTXanwEw,Simple and powerful.,5,0,21.11.255,2022-01-21 05:23:02,,,21.11.255
4f41dce2-9e9c-402a-b52d-f5e8481a8dde,Charles Hale,https://play-lh.googleusercontent.com/a/ACg8ocIk0YrwyBZ9vxNQSL13YMb6tJEoaYYMqZ1Ai5sB2KKtgbskLg=mo,What a handy way to keep an eye on investments!,5,0,21.11.255,2022-01-20 17:20:19,,,21.11.255
34c0fea4-6a6a-409c-b647-aaf3fbe52408,William Fitzpatrick,https://play-lh.googleusercontent.com/a/ACg8ocJOYZugi45MRj6NLmiunHlJZbE8j3t6yPFoKcsz21FaWaOuxQ=mo,"Incredibly user unfriendly. -Can't read research off-line w/out getting timed out of the main app. If you try to navigate back to the app with a report open, it automatically CLOSES the report👎👎👎-Reports highlighted in news or watch lists are not linked. You have to click through multiple options to get to a generic company overview section, then scroll to the end of page. -Overall look & feel of app is 1990s like.",1,14,21.11.255,2022-01-20 13:38:09,,,21.11.255
3203957a-4a48-460c-997a-9ec9e0750a1c,Raheel,https://play-lh.googleusercontent.com/a/ACg8ocJhOU9t2V7G72K_urH6jtMTeTVZ750qhSB6wfCVmaabLT06qnsF=mo,"App is super clunky, the BofA app feels much more polished and speedy",2,0,21.11.255,2022-01-20 04:58:44,,,21.11.255
59a81c94-b73b-45ce-85de-a0886225348e,John Fratto,https://play-lh.googleusercontent.com/a/ACg8ocIZu-YVBOf3dOYfhqMWQFOl3NU8DoTpoPLPb0CMc7n6_44WjWc=mo,Easy and handy,5,0,21.11.255,2022-01-19 19:00:17,,,21.11.255
bbb26e2f-8814-4a33-b9d3-19fbae57bea6,Mike G,https://play-lh.googleusercontent.com/a-/ALV-UjVPk-8ldWcpJcwckyY6AowkVTHMIGeSvLIGudvzNiso_uamHbfK4Q,Horrible company closes your account for no reason after years of being a loyal customer.,1,1,21.11.255,2022-01-19 14:59:27,,,21.11.255
8f5a98c8-e317-4e80-ba60-ea87dbcb90eb,Ricky Helm,https://play-lh.googleusercontent.com/a-/ALV-UjVf0nxo8EeuYRZOY6UUfJtmdpz95LVuoKDEgrGu4HjSEXh8fMJ6vA,"Frustrating to get the information you need, and the holding funds don't clear till 2 days after makes you use margin to make purchases untill clear date. Shouldn't b be charge fees when money is there.",3,0,21.11.255,2022-01-15 19:17:04,,,21.11.255
1947f14d-b305-4e7d-a908-7cdee67411cc,Michael,https://play-lh.googleusercontent.com/a-/ALV-UjVv9QlKH8AX3hpdmfoI8eeyLrEJxWGbFFH8BDQTgmyjk4_025Q,Excellent app with many features.,5,0,21.11.255,2022-01-15 15:42:12,,,21.11.255
75698b61-7890-4b74-8ae7-21ed222b9e0d,E Brown,https://play-lh.googleusercontent.com/a-/ALV-UjXqxoxgVrR0QAHWgoCx9AtZedM5NHXGz4LH966c2HyLhjKlDy_6,App won't advance past login screen.,3,1,21.11.255,2022-01-15 02:53:45,,,21.11.255
6c99490c-3120-4017-840d-d4d0ba7906f0,Flounderpounder,https://play-lh.googleusercontent.com/a/ACg8ocK04nYNhh46HyP-t58baDpKh97wKACY05pAek-wr7c2W7EQpA=mo,Never works when markets falling or pumping,3,0,21.11.255,2022-01-14 20:02:29,,,21.11.255
ed5d938f-26f9-4b7b-80d3-299790f5984d,Benny S,https://play-lh.googleusercontent.com/a/ACg8ocLW0giC6-CDDw7X-52zQlTwta337pIwbYNEL1O5ehsrJUeXAA=mo,The graphs are terrible. I have to open up Yahoo to view the stock before trading on the Merrill app,2,0,21.11.255,2022-01-14 15:40:46,,,21.11.255
d9c54cba-b3af-44a5-b405-fa24b7aa71f1,Denise B.,https://play-lh.googleusercontent.com/a/ACg8ocIOtlqYBbZX5-3u0XDsvgKfFWdoU_dUZWxtezZk4lZbBUuI7w=mo,I just got this today. I didn't know that I have to login every time which is a hassle. But it seems to be very secure which is very important of course!,3,0,21.11.255,2022-01-13 22:36:32,,,21.11.255
98c58d13-6e9f-4aef-ad97-f8cb1015df0c,Kasey,https://play-lh.googleusercontent.com/a-/ALV-UjWt7T7y5s9gWAsoMWRI7AKdCnz_uJIBsKbBo02EKQPM248lLzH1,Stable n fast,5,0,21.11.255,2022-01-13 21:07:31,,,21.11.255
f7d48cfa-c961-434e-8c18-79014c81f687,Arthur Davis,https://play-lh.googleusercontent.com/a/ACg8ocJx8ppdxtxJszKouD_RHBMnv8DDvd16KgJjLNzr5c_-aZdP7w=mo,User friendly,5,0,21.11.255,2022-01-13 20:30:10,,,21.11.255
3c92077f-cd5d-44bb-99bf-5a1a872cff4e,Forstormey,https://play-lh.googleusercontent.com/a-/ALV-UjUAwGx2riPNQ7UL-vddlMRG2XNBhWc8fq0ftWcuCXUsW7WC2NCY0Q,Merrill restricts some trades and execution of orders takes more than 5 minutes sometimes 15.,1,0,21.11.255,2022-01-12 20:07:43,,,21.11.255
d20f3acd-38d5-4519-b32f-b3955edc2940,Sean Q,https://play-lh.googleusercontent.com/a-/ALV-UjWz-lgIfL12Jw9P8RiuOZ6hi5TgdCJ8pR7oz-lblegmwfzwuHiz,"Strange, secure inbox to compose will delete the message when selecting recipient? Design needs several clicks to show portfolio info sufficiently. Error messages not informative, including low cost securities trading. Poor customer contact as no live chat or secure message...need to call on hold over 30 mins, sometimes cannot ever reach a person.",2,7,21.11.255,2022-01-12 19:33:44,,,21.11.255
10bbd7e5-a2f8-44bf-adc0-71af98dbf7bf,odin bujeiro,https://play-lh.googleusercontent.com/a/ACg8ocJmyXbKshSJEVfM2hYrd6dKxwxLqqYJh4Yx48rIUfeMvjkiKg=mo,Super slow,5,0,21.11.255,2022-01-12 14:53:39,,,21.11.255
96772489-830c-47b0-9a59-edfce2adfdc9,Andrew Holman,https://play-lh.googleusercontent.com/a/ACg8ocK1mZI6ZMSLAl3m8p618UGbbm0LsKeV9DFNE05vjKzwWTAD5A=mo,User friendly and fast,5,0,21.11.255,2022-01-05 15:43:56,,,21.11.255
96404a19-48d2-4e21-b699-fe262fb11142,Siddhartha,https://play-lh.googleusercontent.com/a-/ALV-UjWVE1TQtkG-gmMqX0Qlz96PqaMOY_lUptcTnBE2nKEBIOSaS0oo,"Terrible, always breaking down. I've been complaining for over 1 year without any action taken to make it better. All they have to do is get a decent coder in there to fix things",1,3,21.11.255,2022-01-05 07:49:08,,,21.11.255
3555327e-b0f6-453e-8b4a-bf82775be90f,Deepak Narasimhan,https://play-lh.googleusercontent.com/a/ACg8ocJhyBhNb7rAGQ6kHwBPDfheu21SJNMDWPyFoXnui58BNylDAg=mo,Good app,5,0,21.11.255,2022-01-04 18:18:01,,,21.11.255
8e770d26-32ac-490d-82a5-671ee92ae0e9,Yun Chung,https://play-lh.googleusercontent.com/a-/ALV-UjXM73KQrsqpo2Kv0-6ikz9DThWJuGp9KNSCgs4ELuNnW3kFr4ej,"Accurate, Easy, BoA, Current",4,0,21.11.255,2022-01-04 15:46:26,,,21.11.255
7e7b00a1-ae2f-4260-a083-bfa8bd96e4b3,Brendan Hoang,https://play-lh.googleusercontent.com/a/ACg8ocJMqiPf6B6O-R8zsl3iuRRUsxKaNYHhZ2vNHS2CE4v9KCJQFtE=mo,"This app almost never works, the website logs in just fine but any time I try logging into the app it basically always pulls up errors.",1,1,21.11.255,2022-01-03 21:22:21,,,21.11.255
0d3acec6-45ec-4b37-88e2-23792fb8f7ce,PrinceKyra DeJohnette,https://play-lh.googleusercontent.com/a-/ALV-UjX4LN6nxbwDcXJpAAraP5N4zcPkibotpIO7_snX9BC8ZRNvM0JU-Q,Great app. Makes things simple.,5,0,21.11.255,2022-01-02 19:14:52,,,21.11.255
161fe7d4-6a7f-4abf-903e-360a9c0f1494,Arthur Rea,https://play-lh.googleusercontent.com/a/ACg8ocI1O34_7_8EwXDms2ImJ9IGr3r73DtuH6xTXLF7R_7l5GQjkg=mo,Very pleased.,4,0,,2022-01-01 01:45:13,,,
1dec9f6d-7beb-4483-8426-413c39a4427d,William Vlchek,https://play-lh.googleusercontent.com/a/ACg8ocL7BsCPib3vYcgxXu_fHbE9mzMfNG4eJs25-kNxGJaAKi9l5w=mo,No longer works after Android update. Only opens if I go through my bofa app. Agree with others please fix.,1,0,21.11.255,2021-12-30 12:49:47,,,21.11.255
81aad439-151f-447c-ae56-7b4eabc00f7d,Lou S,https://play-lh.googleusercontent.com/a/ACg8ocJpn2T6B8pdJaMDZC2yEdLiJt9k2hpHJBpp-DpHuDw9wp1KcA=mo,Inevitably crashes on Nexus 7 tablet. Works best on later Android.,3,0,21.11.255,2021-12-30 06:25:18,,,21.11.255
4db308db-c835-4001-8e79-7fa634a81503,John Roberts,https://play-lh.googleusercontent.com/a/ACg8ocK1CI74KwcTF1m_6BJrERm4u8MudpGoWOh_TIuA4zPZO9WQ2g=mo,"I'am still learning, but this app offers a lot.",4,0,21.11.255,2021-12-28 05:26:20,,,21.11.255
b109abb5-4e66-4fc6-8f99-881babcbc684,Isaac Asuquo,https://play-lh.googleusercontent.com/a-/ALV-UjVhXk-FGdvS-ZRvMaQyuThad8ha26LgNizAKxbJzhO4G9nhVYgn,Excellent so far,5,0,21.11.255,2021-12-27 21:19:39,,,21.11.255
dd7c0a6f-a4b1-490e-b44e-6b4f336dbf33,Chris Raaz,https://play-lh.googleusercontent.com/a/ACg8ocKZf8fpo916uVB-mcgeo-rhcg1Bp1TwX4d9MeUiF2N3s--gzg=mo,Bug at the time of sending a message,2,2,21.11.255,2021-12-27 06:36:06,,,21.11.255
dab93f37-52fb-4aed-b49f-aa1e2fa5d521,Samantha Clyne,https://play-lh.googleusercontent.com/a-/ALV-UjWzuzPRNd1AM5UQQCB4jS4FCBwFJ24uyRfw7-N_ePyjYZhFVcBu,Great app and features! Connects really easily to BOA app.,5,0,21.11.255,2021-12-26 18:59:47,,,21.11.255
0e6bb9c3-4410-42f7-82e2-f59ffb5f2ae4,Jamar Ingram,https://play-lh.googleusercontent.com/a/ACg8ocIWQnl-mHHj3jpFaVfRzCQLxWjdBJiqMgcobSK0UWxaNLNyhw=mo,Yyyyeeeaaahhh,4,0,,2021-12-26 06:37:05,,,
1c0486ef-f4f8-4e21-b53d-463728d570c1,Marcia Rumsey,https://play-lh.googleusercontent.com/a-/ALV-UjXy7yDbzPXHcpyFos1hAlDDUJGThaEnKHZzwOZ7VAeumD810bWemQ,"If I could ever get access to it I'd be better able to rate it. It will not use my saved password, I have to reenter again and again. No problem with other apps, just this one.",2,8,21.11.255,2021-12-25 15:28:15,,,21.11.255
e0f12d46-442f-4e54-a7be-949b241cb03d,Scott Griffith,https://play-lh.googleusercontent.com/a-/ALV-UjVIQg9sgNOVQzKGpCcXwO17mSUDN0dT6NqiIG32v-yfrcQfLAyi,"Interface is easy to use, funding account is instant and just required a few clicks. Dashboard layout is great.",5,1,21.11.255,2021-12-23 16:57:06,,,21.11.255
7f688282-dcd5-436d-9fcc-d77c1afe0e30,Darren Earley,https://play-lh.googleusercontent.com/a/ACg8ocLlN5Mdo9ygOfSj-J8eTLBOMhEO-UrB5cEsXyeaONFri5GyOg=mo,Always great!,5,0,21.11.255,2021-12-21 23:56:20,,,21.11.255
8f643158-6588-4c21-8942-67f184a93734,Kirk Long,https://play-lh.googleusercontent.com/a-/ALV-UjW_zWYL0_wGslulMUfMlpwl5-td_4yIvJPIJ6qqRum2lN7uy5tq,I love this app!,5,0,21.11.255,2021-12-21 22:36:15,,,21.11.255
62c51136-92e6-4dc4-8868-cb01c7e0612a,Trevor Terris,https://play-lh.googleusercontent.com/a-/ALV-UjV5kxTJsmTL85rAbgVF30yOVDFwjDss0yAMNOM8YstjO9FD7Eg,"Works well. One suggestion, please separate the auto logout notification to a separate notification channel, so I can disable that notification while still being able to view other notifications.",4,2,21.11.255,2021-12-21 16:29:13,,,21.11.255
4b5b340e-4952-4f5e-ab98-f86a78e144b2,Michael Tokle,https://play-lh.googleusercontent.com/a-/ALV-UjXpAfADePj4UvOWE2CMpV4SH2gbZP04cLGC7YKQnWMDTMnqB6gtnQ,"Terrible! This is the wrst brokerage account I have ever had. They are incompetent, make huge mistakes with my investments, orders are not completed correctly and it is nearly impossible to contact anyone. The phone waits on hold are an hour or more until I give up. I can't find a way to contact them via email. Their website is down most of the time, transfers cannot be made and myriad other problems. Conversely I have an Ameritrade account and never had any problems with them.",1,10,21.11.255,2021-12-21 15:16:54,,,21.11.255
c7433369-66ae-48c2-b2fd-e417f6398708,sam smith,https://play-lh.googleusercontent.com/a-/ALV-UjW6ynZnrCU2QUbWXme3oxvY1FVSmOZq13gT_eI0iNmtj0I5f1je,Had issues logging on as there are actually 2 app icons to discern. Confusing start but corrected.,3,0,21.11.255,2021-12-21 00:35:29,,,21.11.255
89e4fd3a-1991-42ff-a245-260202a52430,Favian Hernandez,https://play-lh.googleusercontent.com/a/ACg8ocKJFPlwAezeyUcXky5BVklAmWWDh6ydTLqzyGah1e3JKCunTw=mo,Crashes before it can even open.,1,0,21.11.255,2021-12-20 20:37:32,,,21.11.255
0fae9f4a-aecb-434c-97b3-2609cdcb7c6a,A Google user,https://play-lh.googleusercontent.com/EGemoI2NTXmTsBVtJqk8jxF9rh8ApRWfsIMQSt2uE4OcpQqbFu7f7NbTK05lx80nuSijCz7sc3a277R67g,"UX by garden gnomes. Keeps demanding security questions, ignoring my configured two-factor, which would be far more secure. Broken more often than not in Dec 2021.",1,6,21.11.255,2021-12-18 04:10:14,,,21.11.255
8d4ce38a-d772-441c-94ca-418d14f5336d,Chelsea,https://play-lh.googleusercontent.com/a-/ALV-UjVqhlgN7C7OidDOK4vXt0wj4lqT3S3uNqHTmx7dbtWxeathKmmw,Jackie was helpful at Foothill Farms branch.,5,0,21.11.255,2021-12-18 00:22:04,,,21.11.255
4887fd1e-a515-4ed7-b9da-60a82ab87b6b,Dale Martin,https://play-lh.googleusercontent.com/a-/ALV-UjWhjqNOCkocLtOoS-6lBT1pQzm0G3RIK2ySEa_L3d_-rfirUXs,Easy safe and secure.,5,0,21.11.255,2021-12-17 23:29:50,,,21.11.255
92633d37-065a-4594-a9fc-8aa3f659c82b,VrInfant,https://play-lh.googleusercontent.com/a-/ALV-UjVm11icvube-eyt3vTFGSaAj0yIJlEiM-TRgOs066FCUjN-SY4P,"1hr 20 minutes avg wait time, a glitch made me brake the pdt rule and locked me out from closing positions. They refunded loss thank God. I have 6 brokerage accounts Fidelity, Td, Webull, Sofi, etc.. AS AN ACTIVE TRADER funds settle slow here, to release my funds they said they needed to increase my margin limit ,😕 weird. First time I hear this, app goes down and can't log in, Fidelity, Td, Better easily, maybe good for long term traders",1,0,21.11.255,2021-12-17 17:09:42,,,21.11.255
727687c3-f0eb-4701-b5d5-f54c7f257792,Iam Whôiam,https://play-lh.googleusercontent.com/a-/ALV-UjVsOpMhXuxZPt64-9M0sAMnh_oVokIt4SzG8RKbztgN9Pqzc2Q,"Easy to use, works great with BofA app.",5,0,21.11.255,2021-12-17 16:33:57,,,21.11.255
d7fa7c9d-5d4a-4b84-8278-e0695b6fd7bf,David Koppana,https://play-lh.googleusercontent.com/a/ACg8ocIOPljBjKHoJi0O46b-2JKwRNoYEydF8FSv5q5i1vS5uUxR4g=mo,"This is a ""Best in Class"" APP. The parent company is Bank of America, whose customers expect the best. MERRILL EDGE delivers. Thank you BofA. FYI:MLPFS = Merrill Lynch, Pierce, Fenner,Smith. So thanks to Merrill and dead 'white guys.' Crude pun alas.",5,0,21.09.123,2021-12-17 11:56:19,,,21.09.123
baa7cfa2-48d6-4605-be39-238abe489247,Jason Pal,https://play-lh.googleusercontent.com/a/ACg8ocIft3T9uwSfdFQrGVfMFSnEH-BKMlMVVo7pfHKrzQq7Sl3f=mo,Good,3,0,21.11.255,2021-12-17 04:44:14,,,21.11.255
f31f5230-c3d9-4bb6-990a-e8e4dd4072cf,Brian Samson,https://play-lh.googleusercontent.com/a/ACg8ocLD-XLWUSufG9T_8A9JII06n5999gzijsP68Xq40OO4Dm2rlakK=mo,The fingerprint login doesn't work. Please fix!,1,0,21.11.255,2021-12-16 14:40:16,,,21.11.255
