reviewId,userName,userImage,content,score,thumbsUpCount,reviewCreatedVersion,at,replyContent,repliedAt,appVersion
6e546e3f-99e5-4b03-a4e4-95709a09ef1a,Dennis Marshall,https://play-lh.googleusercontent.com/a-/ALV-UjXjfqVUO7nSGGZUwVMRT9lz9DLLQq3WhX1mxuiWFYkkTOknQz2H,Why does your app insist on asking a lot of personal info about my home mortgage and and other information that's completely none of your business?,2,0,20.10.147,2020-12-04 02:25:37,,,20.10.147
8ddc4701-4dc2-4df4-9d08-11481d929920,Brandon Anderson,https://play-lh.googleusercontent.com/a-/ALV-UjVlId7L81Q_xvDsw00IjTXiQCSOMgV36jxD9RwCMvX-PzLcdcM3,Efficient. Not as flashy as some other apps but its reliable and gets the trades executed.,5,0,20.10.147,2020-12-03 21:30:57,,,20.10.147
6d589263-3811-4fbb-8303-875310de3c31,Miguel Martinez,https://play-lh.googleusercontent.com/a-/ALV-UjViryk19nz4iUCyXoW_wqZH5uYZ9C9qjF_MsQ2BphxqpOysnE2C,Good plat form,5,0,20.10.147,2020-12-03 20:41:25,,,20.10.147
56f76d4e-7234-49c4-8425-504fbf20b06f,daniel rodelo,https://play-lh.googleusercontent.com/a-/ALV-UjUAXFrTGhNl4PHJr0i-aFSsV3JeaRcqzWadTv4hhixJKt6b5h7H,Works flawlessly!! Amazing app!,5,0,20.10.147,2020-12-03 07:36:32,,,20.10.147
1262bc73-8e4b-41a0-983a-4ab658db677c,Jean Carlo Hernandez,https://play-lh.googleusercontent.com/a/ACg8ocIzOiSdDH2HPXKY50AA5RcnJFVrmJX7f9QisnfwKQd5IxXmqg=mo,Easy to use and has everything I need to manage my investments.,5,0,20.10.147,2020-12-02 05:10:28,,,20.10.147
4b7f82cc-5909-4729-91c7-a62879b4aaae,Chef Jacqueline Baldassari Coles,https://play-lh.googleusercontent.com/a-/ALV-UjUbKZu2ld5LJruau3-EyY7qwDgxWu8M1ZpDqBCvE-E6ttjaZ6GN,Extremely easy to use and understand. Great tool for beginners.,5,0,20.10.147,2020-12-01 15:16:20,,,20.10.147
83a056f5-dc9f-4d75-9a3a-5cff9922b9bf,Mike Sepanek,https://play-lh.googleusercontent.com/a-/ALV-UjXGq31gqj3f3qJKrQeQRnZJJ-QYfRGk6cpXTkeiBog_WKG6Jso,"System down during market hours, literally has cost me thousands of dollars in the past few months alone. Junk. USE A DIFFERENT APP",1,0,20.10.147,2020-11-30 15:05:54,,,20.10.147
61ab25a5-db4b-494a-8285-a446a8c506c4,HK Nhan,https://play-lh.googleusercontent.com/a-/ALV-UjX-tes4L9qOV_XF1Z6rQJ9nD2Rg3-8Bp57E7OM05O_5Bs1Mi6di,Love it!!! Easy to use and navigate.,5,0,20.10.147,2020-11-30 14:50:45,,,20.10.147
76ba0f0d-d50f-4d3c-ac8b-281a56eb2c66,Namir Hamid,https://play-lh.googleusercontent.com/a-/ALV-UjVp-7CqGrWCyTsxs562bpGOquzXS9ErvXy2ilUDPEbl7rIBAKxu,Great app . it really is 😌 keep up the good work.,5,0,20.10.147,2020-11-30 14:21:56,,,20.10.147
931df25b-d436-42a1-9937-b84df04f29e1,chakra Maddipati,https://play-lh.googleusercontent.com/a-/ALV-UjW-tRh61AfU6VbybN3GpWbA-ufZaQOSDFpEg0cUMcKG5bn8QErwXA,No good color coding. Somewhat monotonous. Look at fidelity.,4,1,20.10.147,2020-11-27 16:24:05,,,20.10.147
f41e4047-211d-4bbb-ac6a-c43b960a1da4,Customer Service,https://play-lh.googleusercontent.com/a/ACg8ocIpMlmCnPvqThZJ-FRQ7p4wZYMEb3Mm84ePgUi0qGzxJcXovQ=mo,"Lol, crashed everytime on my android. Menu doesn't scroll correctly. I only use it for news and heat lists. upgrade to 2 stars from 1.",2,0,,2020-11-27 14:55:07,,,
c4ba2238-ca9b-45fc-a6be-1255b722d909,Akunna Kustics,https://play-lh.googleusercontent.com/a-/ALV-UjWstWRH9UVwr5MsRxOKOdC8x0-H1H_bnId_pKNEk10QremX_jsa,This app sucks serously! Always mess you up when you want to act quickly.,1,1,20.10.147,2020-11-25 21:16:12,,,20.10.147
2a8ca855-bd25-4da0-86b3-02b703cae8e7,A A,https://play-lh.googleusercontent.com/a/ACg8ocITJUk7-b6IyBef925dJMZ5ipTj_B87bN5iricWiF1YRu4woA=mo,This app is constantly not working and I can not even see my positions. Also It asks to call to execute some trades. Today this app is down for more than 2.5 hoursand Reps are not available. I am loosing money. TD Ameritrade is way more reliable!,1,1,20.10.147,2020-11-25 21:13:15,,,20.10.147
b108f680-bee2-463b-b4ca-158338c67a75,Xiaoyao Zhuge,https://play-lh.googleusercontent.com/a/ACg8ocKNwxWfDm1ZdyyyvlB47PX1v1AwrsOhSegb-MqkDQ7IZVbHZQ=mo,Nothing but failed access when you needed it the most! Disappointing!,1,0,20.10.147,2020-11-25 21:06:22,,,20.10.147
e68e85e2-2ab0-447e-b1ab-97243fe86c76,mitchski98,https://play-lh.googleusercontent.com/a/ACg8ocLxOhHbVfI-ihsd732LYiDQB_2cYUMtpFlnOIQdNk6ed47OXA=mo,Fails during high volatility,1,0,20.10.147,2020-11-25 18:37:37,,,20.10.147
afed9e40-1fe4-4f7c-9c99-d749beb59be5,Daniel Saunders,https://play-lh.googleusercontent.com/a/ACg8ocJf8l_M0C719ISlPROdl-Rmx7WuJfOVrOIj35AgigN5l2XtIg=mo,Merill app and site go down for hours unexpectedly,1,0,20.10.147,2020-11-25 17:20:01,,,20.10.147
894327bc-6cec-4398-a5ad-bdc55356aa0c,George Fears,https://play-lh.googleusercontent.com/a/ACg8ocKwhEo5SMyqa97zsbo8ku7JpxZROZUTcWyFT7Su9vrApTKVkA=mo,"No issues. Very simple to use, except when I lose money buying stocks.",4,0,20.10.147,2020-11-25 14:32:06,,,20.10.147
5d4e095f-5b5c-43a9-8ca5-c95944448165,AlienJulius,https://play-lh.googleusercontent.com/a-/ALV-UjUqpYs900WRy114JW4sfBICqZopLPDnT-O_9fbiTpaR08dTMww,"Very chunky. Gets me my info, but very chunky and clunky.",3,0,20.10.147,2020-11-25 13:52:04,,,20.10.147
61df4c65-7f7d-4d65-ad6a-f5841629f1f7,Aloba Babatunde,https://play-lh.googleusercontent.com/a-/ALV-UjUqH63Ji3hhJfWXgkXr4HMDFgjgKPvPM6j81l7Bx155eyIWy5h0,Still the worst trading app you can ever come across. Slow. Tacky. Not too responsive. Not much data to help decide. Not much has changed since my last rating.,1,1,20.10.147,2020-11-24 20:45:17,,,20.10.147
faad1e5e-3def-4ea0-9baf-786d5ba62887,Ali Alsabe,https://play-lh.googleusercontent.com/a/ACg8ocLGcFmqAlZD7NxevenbkCwcCIWiDmFtMtApHMAzs3seZ1VYb9tt=mo,I thought i delt with bad brokers before. But nothing beats those scammers with their buggy platform. They went out and caused me over $1000 of losses that could've been 100% prevented if I had access to my account. And after all that they never pick up the phone. After 4 hours I spoke to someone and they pretended not to hear me when he knew that I had losses because of them. I'm currently filling a complaint to the FTC and will not let this pass,1,1,20.10.147,2020-11-24 20:19:09,,,20.10.147
e12daae4-45f1-44f9-897a-8f7972086696,xraytech200,https://play-lh.googleusercontent.com/a/ACg8ocJsfdvV_4r26sNHv6Lj4j_6u9n9BUcJBWcYMFfHfONJqL_h1A=mo,"Horrible app. Website down all the time, especially when you need it. These problems came since they became free. They dont want to update their apps and software. CEO GOTS TO GO.",1,1,20.10.147,2020-11-24 18:43:04,,,20.10.147
c811d339-1c9c-4010-b701-2108a75aa24c,faye kingslee,https://play-lh.googleusercontent.com/a-/ALV-UjXJgE5JOoFmdjmd5lCtYpBeaqNiMa-NTHcGlLmwZcveZ5BEGh8r,"This app continues to crash. When timing is everything, how can you not afford to ensure this app remains viable and secure most of the time. this is the third time in two weeks is just crashed for more than half an hour and I cannot use the app. Please put in the calculations for quantities as well.",1,5,20.10.147,2020-11-24 18:30:46,,,20.10.147
e740e855-dd76-4808-95f1-9d8419a9cf03,M,https://play-lh.googleusercontent.com/a/ACg8ocKONgunD6MSQi6533zrvBELrSShIbzuKuxSBhe34fymYTP5Cg=mo,Often down and much slower platform in comparison to others,1,0,20.10.147,2020-11-24 17:26:38,,,20.10.147
702d24ab-f442-41a6-8558-ccbdfdddbfe7,BoBini C,https://play-lh.googleusercontent.com/a/ACg8ocK1OWU9lUQ2xRIMvnTGpT5CVLoeXZTPg3oxMuNSrO6FSiaYfQQ=mo,"OMG, THIS APP IS DOWN AGAIN. IT WAS JUST DOWN ON 9/4/20 ALONG WITH THERE WEBSITE. DO I SEE A MAJOR LAW SUITE COMING-- WHY YES I DO",1,1,20.10.147,2020-11-24 17:04:38,,,20.10.147
daa2df1e-c25f-4817-a950-258c1f800192,Ronald,https://play-lh.googleusercontent.com/a/ACg8ocJvfQPpVRygKJ8HY42ml2CCYLCFiGLlbqG8VytbKjbx4TNC3Q=mo,Sane problem as everyone else this is the 3 rd time this has happen to me could not take profits and lost out this is a ridiculous app they should realize this is real money and compensate for any loss of profits due to app issues,1,1,20.10.147,2020-11-24 17:01:51,,,20.10.147
973d2944-0f5d-4244-80a3-1c4abd5ae440,Mohanraj Jayaraman,https://play-lh.googleusercontent.com/a/ACg8ocLZQw47sm43f4Q-2-ysqm9tyUynZ2MulFmRkdvtq_W_fIAHpA=mo,"Well, the app goes down at least twice a month during business hours. Seems they want to make this an industry standard. Thinking a lot about getting out of brokerage these days. You loose one more star now.",2,3,20.10.147,2020-11-24 16:40:25,,,20.10.147
88df1944-b30a-4cf7-8681-b7bb9a908992,Louis Stejskal,https://play-lh.googleusercontent.com/a/ACg8ocKn-jsEnQUwFU87BK3K18myt9LuXNNasRxXB2aePjhVMfTEzQ=mo,Site Down Far Too Often. This 2 star rating is not for the app itself but for Merrill Edge Pierce Fenner Smith. Their trading platform is down far too often. And it's not down for 10 min. It's often down on huge swing days (up or down). And then it can be down for over an hour. Any trader reading this realizes the implications here. Sure you can call to make a trade. But if everyone can't log in the hold time jumps to 2+ hours. Not a reliable trading platform though many other features are great,2,2,20.10.147,2020-11-24 16:36:00,,,20.10.147
23127bc8-7b98-4696-bf76-fc29dcc45ef2,Reza Madankan,https://play-lh.googleusercontent.com/a-/ALV-UjVb9hG5usvYBr2Ap1alNQm6NLTlTcpga7XBwU80qNsuSTr0xPvz,"It often happens that ""the app is temporarily unavailable"", and blocks from logging in and doing your trade. Please fix it or I move my money to robinhood!",2,0,20.10.147,2020-11-24 16:22:02,,,20.10.147
eeb587e5-2e5e-4a1a-a62a-2c3d9a6df859,Jimmy Chi,https://play-lh.googleusercontent.com/a/ACg8ocKKWzN1xI-mQlKRqOx1H1KUHIl6xmMx5P7zYMc161BMQ4eBQg=mo,Bad,1,0,20.10.147,2020-11-24 16:09:57,,,20.10.147
d2298f9e-5e9a-40cd-83b8-e19d4e005a0d,tony li,https://play-lh.googleusercontent.com/a-/ALV-UjWl80LGpLIcA-AFoTGuuaHmkoTSryaEvm4GB1K2-cho44oAM8g,too many time app down during trading hours,1,0,20.10.147,2020-11-24 16:06:01,,,20.10.147
bc5e755c-65ad-4161-a98c-b90323479268,David Chu,https://play-lh.googleusercontent.com/a/ACg8ocJlGiAGBBqwJRXLHABKK1R-PzXqCaSWY3t4xGV4ubhc5jv7fw=mo,Can't login,1,0,20.09.159,2020-11-24 15:37:12,,,20.09.159
770f153a-319b-4b45-bf8d-4462351bb407,Paul N,https://play-lh.googleusercontent.com/a/ACg8ocI5YruHII79apZQCY99xYwGyotwEJpCsjvu_gLwfOES-NMw5A=mo,It's a glitchy software that has cost me large percentages on my portfolio due to the mobile app not responding to orders or being down .,2,0,,2020-11-24 15:30:57,,,
0da8f09c-108f-435c-911c-b8107e18de5e,Kevin Le,https://play-lh.googleusercontent.com/a/ACg8ocL9uSez8SHNV5PAsqck-f2GNtnYBEy-uaMtYCTxA5YIXWkTeQ=mo,"The website and app constantly fails under high trading volumes. If you're a trader or need to access your account to make critical trades, then this isn't the platform for you. I'll be moving my money elsewhere.",1,1,20.10.147,2020-11-24 15:21:06,,,20.10.147
832d76ac-c966-4569-bdff-637140154315,Xin Liu,https://play-lh.googleusercontent.com/a-/ALV-UjX0WQ9xaYY0VQkof2AEvi-zZ8NevKCN90gJEmyKWOhlMULCsqvn,Can not login. Happened often.,1,0,20.10.147,2020-11-24 15:14:39,,,20.10.147
7b1a53d5-9fbc-4666-9c91-b675c77a1335,Dalton Malaby,https://play-lh.googleusercontent.com/a-/ALV-UjUxZoFQ_2BznQ8PNNsn3Q9HOH7kxeTXKxip1ndSWIQ8lbnP3tDwjw,"Log in has been broken twice in the last month on massive trading days. I transferred to Merrill because of the ease and convenience with BOA, but this is terrible. Not having real time access to your account is a massive risk. I don't day trade, but with the markets the way they are there are a lot of uncertainties to buy and sell on. Very likely switching my assets over to TD if this isn't fixed. I've lost money because of this.",2,4,20.10.147,2020-11-24 15:14:27,,,20.10.147
bf5bc1be-8026-4232-97c5-0c05fd5e4a31,Peter Aungle,https://play-lh.googleusercontent.com/a-/ALV-UjVxkHnDcv2-6JCwflxoQdjTDiTZs9mBlHQaO8D8_3g9tXFww0Zl,Beyond slow,2,0,20.10.147,2020-11-24 15:11:08,,,20.10.147
ee0cfa69-46e7-47fd-a32e-baf0915e82d2,Aaron Buchanan,https://play-lh.googleusercontent.com/a/ACg8ocJ4M8wXhPB2AGuaGVlSNIlocXoIRSr_CxnKpBGVi2eb6mqzpw=mo,Works SOMETIMES.,1,0,20.10.147,2020-11-24 15:06:07,,,20.10.147
a7479bab-4356-49e6-8a87-ace10f56da48,Stephen McGrady,https://play-lh.googleusercontent.com/a/ACg8ocLr5hefylAaZmuXrgnhA6nWJvCHWnPf0an4oxJf7bTlh9qIkQ=mo,"Lags terribly, I wish I could give 0 stars.",1,0,20.10.147,2020-11-24 15:06:01,,,20.10.147
91b2f2c0-28b3-4de0-8fca-8a9f5cb5d11e,George Young,https://play-lh.googleusercontent.com/a/ACg8ocLAh9URiCgH9Xw0Ej7MdQ3_vBDFYuF5pCCc60hyITGU_NB2aA=mo,What good is a trading app when it doesn't work when you need it most! Fix your app already!!,1,0,20.10.147,2020-11-24 15:03:43,,,20.10.147
d0cb8cd3-9d25-4daf-b649-5e732b4c3d93,Kurdapyo Ako,https://play-lh.googleusercontent.com/a/ACg8ocIaT6JQN-aPIY3cSHCI-rWPEnDVpmQFvmlVgjGjK66IZMEPY4c=mo,Fail to log in. Lost a lot of money. Stay away from this company. We bull account and Robinhood much way better. 😡😡😡,1,0,20.10.147,2020-11-24 15:01:03,,,20.10.147
393c9099-5960-4d65-982f-95eec7678441,mykovasyl,https://play-lh.googleusercontent.com/a/ACg8ocK1acCldbaPYbjICcJNrDiQv4bROv5v8ravyLj3UfOl4wzFRw=mo,"Why are there constant outages on your app and online platform? And it's usually on some of the most volatile days. Last time this happened, I lost $1k in market value because I couldn't put in any orders and had to sit and watch my balance plummet. Your company is too big to be having these types of issues during trading hours. You also desperately need to improve your charts on the app.",1,2,20.10.147,2020-11-24 15:00:45,,,20.10.147
ebc9b252-6206-4e7f-8415-95ca0040649e,Alex iannotti,https://play-lh.googleusercontent.com/a/ACg8ocJz-taySCUGz5pmUdMrdZNFIiZ858j19Nm_XVTHNh0mbmao4Q=mo,Crashes and won't load multiple times a week. Pathetic that this is a financial planning app.,1,0,20.10.147,2020-11-24 14:53:27,,,20.10.147
bfbb4e5e-ae2b-46da-bff4-44c2e0701071,Donna Flenory,https://play-lh.googleusercontent.com/a-/ALV-UjWt06M58rvr9dxvv0Is0ARdy8k8ARWaj9elKfsEjh0bPU2EJEfI,It's new since I last logged on and it took a little getting use to where everything is now located! Otherwise it was a good experience.,4,0,,2020-11-24 04:32:02,,,
07e2e8e4-b06f-4b80-9961-bff197eed3f1,Joe,https://play-lh.googleusercontent.com/a/ACg8ocI3EXlxAFEZbE_ycr6xDQeqmS20UwrR5BMec2ZaV0PBFaSQMg=mo,Pretty good Bank of America Merrill Lynch should have one app,3,0,,2020-11-23 20:08:16,,,
946dd4ad-7966-4ec6-adda-5e4e9e0301cc,Rudy Olvera,https://play-lh.googleusercontent.com/a/ACg8ocLthHqj0lYwJlKkRAYIOmoR7bPwx5Am0WhWF8ijz7qFh1xz5KKj=mo,Excellent,5,0,20.10.147,2020-11-23 16:34:17,,,20.10.147
62594f4c-8ce3-400f-817c-82d17a27146e,Jesse Rushworth,https://play-lh.googleusercontent.com/a/ACg8ocK2OHItbrrHguhmjcemN4KPCGnpiJRjAzXyl6SiytELn5GKTw=mo,Interface is not great. Feels too much like operating a desktop program on my phone.,4,0,20.10.147,2020-11-22 12:34:56,,,20.10.147
06eb1412-3369-44ee-9126-96723bdf1941,Nathan Coleman,https://play-lh.googleusercontent.com/a/ACg8ocI5SKIY_3_0mU4dTZamFYUi6Dr2YhxSRee1lx1vxN_6G12Lxg=mo,"Great, easy to use, good info",5,0,20.09.159,2020-11-20 19:54:52,,,20.09.159
d6c189d6-970d-41ca-a409-ff1feb2fea5b,nelson sostre,https://play-lh.googleusercontent.com/a/ACg8ocKqeE9lgOSX7DA2n9ywSymYPeRJ0kanxSJxMDIzhWPb-Wbr-g=mo,Terrific! Thanks to the alerts I have been able to capitalize.,5,0,20.09.159,2020-11-19 20:11:29,,,20.09.159
118e8351-da2b-41a4-af72-521f30668ea4,Justin Richards,https://play-lh.googleusercontent.com/a-/ALV-UjVMEHxx_IsCvdGGoG7gOiiPk_PXzVJbHwQ94jqZs4bXj0lVymQ-,"They have all weekend do shut down the app for maintenance. Yet, they decide to do it at 9:30am on a Monday, right when the market opens. Or the app simply cannot handle large volumes, either way it's terrible. Only have it because it's easy to transfer funds between Bank of America.",1,12,20.10.147,2020-11-19 10:57:27,,,20.10.147
9a1a01f4-fe33-4bc6-a6b2-30092cd477a2,Lee Bailey,https://play-lh.googleusercontent.com/a/ACg8ocL748q3al6MExfaTYOzn2c8axpPQL-TK4dicjc-jd88yYi1ig=mo,Excellent,5,0,20.09.159,2020-11-18 17:13:31,,,20.09.159
8366baa3-2413-4cb9-af2b-fdf0b3ac4ba1,Michael Penton,https://play-lh.googleusercontent.com/a-/ALV-UjW7A29JEcM7MUWVdDfw4NoW1sRSUANDT_w3gVkatk84gYHZ6iwcGA,"Very good for information, and taking care of my portfolio.",4,0,20.09.159,2020-11-18 11:26:13,,,20.09.159
cba1a693-9b2c-434f-91b0-c2163236c72a,Bonnie Wiley,https://play-lh.googleusercontent.com/a-/ALV-UjXjhFah-Lkxugb1_aLyRMI7M03kzXfN4Gt6x1JT5KiCk7KNI43T,Could not open the app.,1,1,20.09.159,2020-11-18 06:54:31,,,20.09.159
89ea857d-5491-4437-b525-c5758ed5f068,Jennifer Wilson,https://play-lh.googleusercontent.com/a-/ALV-UjWr80gF_hpQblDNUpnsQO6QMEvB7zZ5Mg826fMCESrVE1Eh0xme,Technology at its finest,5,0,20.09.159,2020-11-18 01:00:21,,,20.09.159
669c147b-0efc-4f3e-b36f-8fa23e1636e9,Larry Starnes,https://play-lh.googleusercontent.com/a-/ALV-UjVWnP9DHno-TlZz38satX6ypXkbgpJHvF0p0yCQ-k4vCoGbVY5y,I am able to keep up with progress of each of my stock investments. The data available is very complete and the app is flexible in viewing different elements of each stock. I would like to be able to see the return and yield results for my mutual fund investments like I can on individual stocks.,5,3,20.09.159,2020-11-17 14:57:45,,,20.09.159
87144056-b081-4984-9e83-2b816873cf5e,Ramon Gonzalez,https://play-lh.googleusercontent.com/a-/ALV-UjULG5javTxqzAdnNqVTiJ6eef8jWoC_TPlJvq3fQcGLDVOgto4,"Not as intuitive asninwould like, much easier to use the desk top website. Which I think is a loss's as mobile should be the one stop shop now-a-days",4,0,,2020-11-17 03:27:34,,,
f1506c80-b87f-417e-aafc-d69c98e1a308,Viral Modi,https://play-lh.googleusercontent.com/a-/ALV-UjU36LU_Q2oaRl91_5jsnZbx6merzX_hORgssBsJgvxgFNmygVBW,Easy and seamless to use. Especially like this rating app since I tested it :),5,0,20.09.159,2020-11-17 02:08:00,,,20.09.159
660b543e-7695-4032-8835-095912816509,Matt Lassiter,https://play-lh.googleusercontent.com/a-/ALV-UjW-l1aa5qmLe0pj3GCqwLkhymHeFstgEtFZ_XUH7iFiaL3D7dydfg,Widget will not display watch list securities,2,1,20.09.159,2020-11-16 19:30:06,,,20.09.159
8eac9931-1412-4874-a640-26251c654daf,Tifany Gilmore,https://play-lh.googleusercontent.com/a-/ALV-UjWAqeRDAc-zcCQPu-MraOJVugaUuQnanNfV8nl_S06LRBl_XAhq,Not user friendly,3,0,20.09.159,2020-11-14 14:45:15,,,20.09.159
eaba3af1-5972-45ff-bd9b-462b2466c5b5,susan h,https://play-lh.googleusercontent.com/a/ACg8ocLlFjUTTG6ZbR_7adzm7_smxaMUgOKg888R5Y2RInRB9MHmAA=mo,Great,5,0,20.09.159,2020-11-14 12:21:14,,,20.09.159
d0f50026-1413-4236-8bdc-874e539bae6a,isabel valtierra,https://play-lh.googleusercontent.com/a-/ALV-UjXDeMmmT5xwIC3Lr5-gvs6Cr6hjrh8oLXMT41r57LUfyz3OmmRVtw,Needs to be more user friendly.,3,1,20.09.159,2020-11-13 15:15:01,,,20.09.159
f900e533-b60e-4de8-b580-277aab4834d3,Joma Rodriguez,https://play-lh.googleusercontent.com/a-/ALV-UjU38fkk3O3Fch3YuvVR5WP7O03JRgvLgmPdFMZQwCexxbKOrdvJ,Probably the worst trading app in the whole store. Totally useless if you want to place a fast trade. Lost money on erroring out from trades. Do not use this app to place quick trades. I wish I could give it 0 stars. I will never use this app again. Use robinhood or etrade.,1,3,20.09.159,2020-11-12 15:48:49,,,20.09.159
96388a69-720d-43b9-879a-cd0dd8ff4bf7,Larry Levine,https://play-lh.googleusercontent.com/a-/ALV-UjXZGlOlM9DTCPL3myzrYDVA_yQnQ8VewFFulb1fIhWtBSiyEd1dmA,Not intuitive. Phone looks and navigates differently.,2,1,20.09.159,2020-11-11 18:51:08,,,20.09.159
deb57bef-867b-4e04-bd2d-27c68116194f,Tim,https://play-lh.googleusercontent.com/a-/ALV-UjX4stfWmtplQ20YXw4DjDGjlmtsRAuc2rw04tGl5GeZohgewN-mtg,Pros: you can make trades...eventually. Cons: just about everything else... why can we not even choose *lots* to sell on the app? Insanity.,2,2,20.09.159,2020-11-11 17:20:46,,,20.09.159
635c0393-0469-408a-8b34-3a8ebb9c565f,Julian Espino,https://play-lh.googleusercontent.com/a/ACg8ocJIR4H2EtfLlyBCYx3OoV0s53mnF98HP6nh2Xsw70L6Q2MBUg=mo,Clean. Easy to use. Customer support is awesome also.,5,0,20.09.159,2020-11-11 13:15:22,,,20.09.159
42704a48-a9d9-4b16-82fc-fbaa35e8634e,Joe Zajac,https://play-lh.googleusercontent.com/a-/ALV-UjX9haTDCOkr0w9CfFlv9kW5dNE4q2RGjsGPPbLcN2_9iDLclKfC,"The App is fully functional. There's tons of research on the site. It's offered and provided, if you're serious, bring your investments and skip over the Robinhoods...",5,0,20.09.159,2020-11-10 17:38:56,,,20.09.159
ad8ed008-c205-4816-9041-baf362b75255,Jelani Bass,https://play-lh.googleusercontent.com/a-/ALV-UjV6u8DSkqpY2MJIvE-PDxBt2Lqdv3lAeUFiIO_Pf-Jj-UfPP_2Z,Very easy to use. I have enjoyed my experience with Merrill Edge so far.,5,0,,2020-11-09 21:44:06,,,
7481e97a-751d-4ab0-9c67-00dd02c51827,Naren Gandhi,https://play-lh.googleusercontent.com/a/ACg8ocKuW3s37_RNdA5X3i04wjceY_aWboIgei1HUTxWarOgcmUxXQ=mo,The updates suck,1,0,20.07.99,2020-11-09 19:10:20,,,20.07.99
05c9dec2-684e-4ce6-9da9-9e6d8a8ff972,Tempte Last,https://play-lh.googleusercontent.com/a/ACg8ocLZHppOhpCsBcK3Pl1WseqwFMpdVsKX8RoSn2dC9H9DnLXA=mo,It is not realible. Where is a drop or surge. The app stop response,3,2,20.09.159,2020-11-09 15:52:49,,,20.09.159
390203a3-387f-4c63-b22a-e66078df62a8,Boban Raw,https://play-lh.googleusercontent.com/a-/ALV-UjXE5i7-49fq3P4XlHxxuIIGUNpMPevn3JWkW4mC1aQJ182FCAVA,Slow ass platform and always have trouble.,1,1,20.09.159,2020-11-09 15:09:18,,,20.09.159
395f0372-6a0d-4c96-a017-2d528737ac66,Maitreyi Nachuri,https://play-lh.googleusercontent.com/a-/ALV-UjV_TDItNuSwLB3GYMz9LJ_wApOOSKb3ya5tVpLajqHzS_YnYJg,Terrible app. Goes down for scheduled maintenance during reading hours. Very few features compared to other trading platforms.,1,5,20.09.159,2020-11-09 15:02:28,,,20.09.159
bdf821b2-e373-4e67-b54b-2d90de0d4e12,Darren,https://play-lh.googleusercontent.com/a/ACg8ocLloJL6V5oFViERHIWoy33Wga1a2vwtFL3AXrbxeeD40Z28fQ=mo,"App works great unless it is a major trading day (large moves either way). I dont think the Merrill servers are sized to handle large volumes. Without fail, 4 times in the last year when there are 5% market moves, both the app and online access fails. The app always says ""scheduled maintenance"" when this happes but that is flat out lie. Always on large volume and % swing days. Always.",2,9,20.09.159,2020-11-09 14:49:02,,,20.09.159
6065efbe-de77-4d9d-86ee-9dd4de8dedb9,raymond westrick,https://play-lh.googleusercontent.com/a-/ALV-UjVfSmk4gtnGgZASMvHWsTGPKrdxQLJjGvLRMrtdNS7IX62n9ZE,"Complete garbage, cannot log in during busy times... leaving a lot of money lost",1,3,20.09.159,2020-11-09 14:44:41,,,20.09.159
929c8752-073f-4ced-a870-cb1ce32674f0,Vincent McDaniel,https://play-lh.googleusercontent.com/a/ACg8ocKrDy9MazhbKUvLp9IiTlQoCvjujgdZCt-R9rTtlDN-J9Jb4w=mo,"Good app not as sexy and appealing as Robin Hood or Webull. The app is really boring. However very easy to use. I wish Merrill Edge app allowed for easy ACH deposits with other banks like Robin Hood or Webull. I considering possibly transferring my securities to Robin Hood, but Merrill Edge has just been really good.",4,1,20.09.159,2020-11-08 19:39:59,,,20.09.159
58c15176-3368-4a15-a468-8fab83517bc8,Thomas Phan,https://play-lh.googleusercontent.com/a-/ALV-UjUjVskFd3lRr1lfPlcLda_14Rqle42pKsQWjiub8kp2b8c0oII,"I've used fidelity and Charles Schwab apps. Merrill edge is the best, their research button is better then most websites and easier to use",5,0,20.09.159,2020-11-06 21:27:19,,,20.09.159
e5b1e949-9867-480a-a489-f070f42fdaa8,Kevin Chan,https://play-lh.googleusercontent.com/a/ACg8ocLGyVbYafXcna4BwiUHfN1w2cgowewUYktEb7E_ZgliGQZ1Hg=mo,App sucks. So many bugs and poor options management,2,0,,2020-11-06 18:22:26,,,
2d603624-d7a2-4b86-a713-26461e04010b,joel bell,https://play-lh.googleusercontent.com/a-/ALV-UjVhUejUezqWVY1Jd-gYOzSiJKEto6KEoqDqHLyjufA8dT0JqHGJpQ,"Convenient, Easy to use, great research info",5,0,20.09.159,2020-11-06 11:57:26,,,20.09.159
8eefeabe-79b7-4089-9ee4-fdda3b4322a8,Rick B,https://play-lh.googleusercontent.com/a/ACg8ocLwZwvCubCXuHpfBtm4Rl5xKpxt7pSYQiu8E5SlzPjdYGykhQ=mo,The app hasn't let me log in for months so I always have to go a browser.,1,2,20.09.159,2020-11-05 23:17:26,,,20.09.159
3a3efc01-ea78-441a-a846-d2d1f35b195e,Benjamin Smith,https://play-lh.googleusercontent.com/a-/ALV-UjXuPgnQjLe6PsedhUs-dYVW3yK5wIsa5H9xMo20E5AMVjWN4_hl,Great app,4,0,20.09.159,2020-11-04 12:15:51,,,20.09.159
1e820388-96fc-44d4-991a-58d6147207e3,Esuza Aitken,https://play-lh.googleusercontent.com/a/ACg8ocJgWKD-ljWLjwjy68oIovY_1KkiFW8mxGBFtkdeh0tyChrVGg=mo,Ease of use,5,0,20.09.159,2020-11-03 22:08:23,,,20.09.159
bb78fb49-44df-43d2-898c-4dc7edc6d6ab,John JW W,https://play-lh.googleusercontent.com/a/ACg8ocKGNBDHv1yrJWYHvNOu2Eg7onqtNa8xaLJhRt2rJ6IC87USAQ=mo,"Should be easier to do a deposit, or my pw is to long",5,0,20.09.159,2020-11-03 22:06:33,,,20.09.159
49b58dca-aa0f-4804-be60-9e6ee487fa3b,David Houge,https://play-lh.googleusercontent.com/a/ACg8ocJT8AhRT_QsTWFAY8_YaWUtxalVwMfYjIVLyZSoLnPHYXZnGQ=mo,Very easy to navigate nice graphics,4,0,20.09.159,2020-11-03 17:29:45,,,20.09.159
9cdda2cb-07aa-4a49-b005-78d1c7ef4075,F Zhang,https://play-lh.googleusercontent.com/a/ACg8ocKwpyL75TYER8ArtkIiB-t-1lN7C4HOb2JV4bC7ooYnk9iAPw=mo,Cannot log in using fingerprint even i changed a new andriod phone. But i can do that with BOA app and all other apps. There is sth wrong with the setting which is hard to figure out. Frustrated.,1,2,8.1.99,2020-11-03 04:26:24,,,8.1.99
ef6ce91a-4cdc-4933-93f8-169d95b53ac6,Tô'nì Dēē (Trilly Drill),https://play-lh.googleusercontent.com/a-/ALV-UjWS-2e-Dkfrc3dKSBG598hKW5mOcS85WPZlcUnW7Squ3uHgeSNw,Amazing,5,0,20.09.159,2020-11-02 19:28:45,,,20.09.159
5a9d4a27-457a-401d-b1b7-82b17ad6c7ee,Michael Vorel,https://play-lh.googleusercontent.com/a-/ALV-UjWLRvLoitkgmZKangDbPs1C7zRXruSck5Rtua8Wd7FQVHAmJaps,Fair though very different than website interface,3,0,20.09.159,2020-11-02 16:00:40,,,20.09.159
a19581b1-9603-499c-bfaf-e7a141d3e7ba,Gary Abbott,https://play-lh.googleusercontent.com/a-/ALV-UjWlglMXtLji-cqUymHe_hzqATU8AZiWWC96DiDXNDq19ruSkl4e,Excellent! Love being able to self direct and have a watch list.,5,0,20.09.159,2020-11-01 16:59:05,,,20.09.159
